2026-01-27 22:53:49,682 - INFO - Logging to /home/anshulk/Housing/data/probe_results/logs/probe_llama-3.2-3b_2_fewshot_cot_temp0_20260127_225349.log
2026-01-27 22:53:49,682 - INFO - Loading activations from /home/anshulk/Housing/data/activations/llama-3.2-3b_2_fewshot_cot_temp0_activations.npz
2026-01-27 22:54:01,900 - INFO - Loaded activations: (5130, 28, 3072)
2026-01-27 22:54:01,900 - INFO - Labels shape: (5130,)
2026-01-27 22:54:01,900 - INFO - Feature labels columns: ['bathrooms_p1_more', 'bedrooms_p1_more', 'year_p1_newer', 'lot_p1_larger', 'sqft_p1_larger', 'price_p1_higher']
2026-01-27 22:54:01,900 - INFO - Model: llama-3.2-3b
2026-01-27 22:54:01,900 - INFO - Condition: 2_fewshot_cot_temp0
2026-01-27 22:54:01,900 - INFO - Samples: 5130
2026-01-27 22:54:01,900 - INFO - Layers: 28
2026-01-27 22:54:01,900 - INFO - D_model: 3072
2026-01-27 22:54:01,900 - INFO - Features: ['bathrooms_p1_more', 'bedrooms_p1_more', 'sqft_p1_larger', 'lot_p1_larger', 'year_p1_newer', 'price_p1_higher']
2026-01-27 22:54:01,900 - INFO - Split: 70/10/20 (train/val/test)
2026-01-27 22:54:01,900 - INFO - C selection: Validation set (fast mode)
2026-01-27 22:54:01,901 - INFO - GPU acceleration: ENABLED (cuML - full pipeline)
2026-01-27 22:54:01,901 - INFO - Creating stratified train/val/test splits...
2026-01-27 22:54:01,907 - INFO -   Train: 3590 samples
2026-01-27 22:54:01,907 - INFO -   Val: 514 samples
2026-01-27 22:54:01,907 - INFO -   Test: 1026 samples
2026-01-27 22:54:01,911 - INFO - Probing feature: bathrooms_p1_more
2026-01-27 22:54:11,366 - INFO -   Layer 0: acc=0.704 [0.675, 0.731] p=0.0000 *
2026-01-27 22:54:17,166 - INFO -   Layer 1: acc=0.725 [0.697, 0.752] p=0.0000 *
2026-01-27 22:54:22,976 - INFO -   Layer 2: acc=0.711 [0.682, 0.737] p=0.0000 *
2026-01-27 22:54:28,860 - INFO -   Layer 3: acc=0.719 [0.691, 0.746] p=0.0000 *
2026-01-27 22:54:34,596 - INFO -   Layer 4: acc=0.703 [0.674, 0.730] p=0.0000 *
2026-01-27 22:54:40,207 - INFO -   Layer 5: acc=0.713 [0.685, 0.740] p=0.0000 *
2026-01-27 22:54:45,814 - INFO -   Layer 6: acc=0.727 [0.699, 0.753] p=0.0000 *
2026-01-27 22:54:51,325 - INFO -   Layer 7: acc=0.760 [0.733, 0.785] p=0.0000 *
2026-01-27 22:54:57,146 - INFO -   Layer 8: acc=0.769 [0.742, 0.794] p=0.0000 *
2026-01-27 22:55:02,722 - INFO -   Layer 9: acc=0.774 [0.747, 0.798] p=0.0000 *
2026-01-27 22:55:08,321 - INFO -   Layer 10: acc=0.776 [0.749, 0.800] p=0.0000 *
2026-01-27 22:55:13,917 - INFO -   Layer 11: acc=0.816 [0.791, 0.838] p=0.0000 *
2026-01-27 22:55:19,358 - INFO -   Layer 12: acc=0.874 [0.853, 0.893] p=0.0000 *
2026-01-27 22:55:25,074 - INFO -   Layer 13: acc=0.887 [0.866, 0.905] p=0.0000 *
2026-01-27 22:55:30,434 - INFO -   Layer 14: acc=0.886 [0.865, 0.904] p=0.0000 *
2026-01-27 22:55:36,027 - INFO -   Layer 15: acc=0.902 [0.882, 0.918] p=0.0000 *
2026-01-27 22:55:41,683 - INFO -   Layer 16: acc=0.891 [0.870, 0.908] p=0.0000 *
2026-01-27 22:55:47,258 - INFO -   Layer 17: acc=0.891 [0.870, 0.908] p=0.0000 *
2026-01-27 22:55:52,806 - INFO -   Layer 18: acc=0.884 [0.863, 0.902] p=0.0000 *
2026-01-27 22:55:58,300 - INFO -   Layer 19: acc=0.883 [0.862, 0.901] p=0.0000 *
2026-01-27 22:56:03,622 - INFO -   Layer 20: acc=0.852 [0.829, 0.872] p=0.0000 *
2026-01-27 22:56:09,294 - INFO -   Layer 21: acc=0.868 [0.846, 0.888] p=0.0000 *
2026-01-27 22:56:15,051 - INFO -   Layer 22: acc=0.865 [0.843, 0.885] p=0.0000 *
2026-01-27 22:56:20,232 - INFO -   Layer 23: acc=0.876 [0.855, 0.895] p=0.0000 *
2026-01-27 22:56:25,872 - INFO -   Layer 24: acc=0.875 [0.854, 0.894] p=0.0000 *
2026-01-27 22:56:31,419 - INFO -   Layer 25: acc=0.884 [0.863, 0.902] p=0.0000 *
2026-01-27 22:56:36,699 - INFO -   Layer 26: acc=0.886 [0.865, 0.904] p=0.0000 *
2026-01-27 22:56:42,691 - INFO -   Layer 27: acc=0.875 [0.854, 0.894] p=0.0000 *
2026-01-27 22:56:42,692 - INFO - Probing feature: bedrooms_p1_more
2026-01-27 22:56:48,314 - INFO -   Layer 0: acc=0.699 [0.670, 0.726] p=0.0000 *
2026-01-27 22:56:54,026 - INFO -   Layer 1: acc=0.719 [0.691, 0.746] p=0.0000 *
2026-01-27 22:56:59,836 - INFO -   Layer 2: acc=0.765 [0.738, 0.790] p=0.0000 *
2026-01-27 22:57:05,500 - INFO -   Layer 3: acc=0.755 [0.728, 0.781] p=0.0000 *
2026-01-27 22:57:10,774 - INFO -   Layer 4: acc=0.741 [0.713, 0.767] p=0.0000 *
2026-01-27 22:57:16,787 - INFO -   Layer 5: acc=0.729 [0.701, 0.755] p=0.0000 *
2026-01-27 22:57:22,331 - INFO -   Layer 6: acc=0.759 [0.732, 0.784] p=0.0000 *
2026-01-27 22:57:27,854 - INFO -   Layer 7: acc=0.782 [0.755, 0.806] p=0.0000 *
2026-01-27 22:57:33,306 - INFO -   Layer 8: acc=0.771 [0.744, 0.796] p=0.0000 *
2026-01-27 22:57:38,979 - INFO -   Layer 9: acc=0.790 [0.764, 0.814] p=0.0000 *
2026-01-27 22:57:44,753 - INFO -   Layer 10: acc=0.811 [0.786, 0.834] p=0.0000 *
2026-01-27 22:57:50,360 - INFO -   Layer 11: acc=0.840 [0.816, 0.861] p=0.0000 *
2026-01-27 22:57:55,925 - INFO -   Layer 12: acc=0.876 [0.855, 0.895] p=0.0000 *
2026-01-27 22:58:01,498 - INFO -   Layer 13: acc=0.902 [0.882, 0.918] p=0.0000 *
2026-01-27 22:58:06,743 - INFO -   Layer 14: acc=0.893 [0.872, 0.910] p=0.0000 *
2026-01-27 22:58:12,617 - INFO -   Layer 15: acc=0.910 [0.891, 0.926] p=0.0000 *
2026-01-27 22:58:18,217 - INFO -   Layer 16: acc=0.904 [0.884, 0.920] p=0.0000 *
2026-01-27 22:58:23,523 - INFO -   Layer 17: acc=0.896 [0.876, 0.913] p=0.0000 *
2026-01-27 22:58:28,532 - INFO -   Layer 18: acc=0.886 [0.865, 0.904] p=0.0000 *
2026-01-27 22:58:33,910 - INFO -   Layer 19: acc=0.894 [0.873, 0.911] p=0.0000 *
2026-01-27 22:58:39,475 - INFO -   Layer 20: acc=0.886 [0.865, 0.904] p=0.0000 *
2026-01-27 22:58:44,858 - INFO -   Layer 21: acc=0.876 [0.855, 0.895] p=0.0000 *
2026-01-27 22:58:50,439 - INFO -   Layer 22: acc=0.883 [0.862, 0.901] p=0.0000 *
2026-01-27 22:58:56,071 - INFO -   Layer 23: acc=0.890 [0.869, 0.908] p=0.0000 *
2026-01-27 22:59:01,445 - INFO -   Layer 24: acc=0.887 [0.866, 0.905] p=0.0000 *
2026-01-27 22:59:07,038 - INFO -   Layer 25: acc=0.888 [0.867, 0.906] p=0.0000 *
2026-01-27 22:59:12,208 - INFO -   Layer 26: acc=0.898 [0.878, 0.915] p=0.0000 *
2026-01-27 22:59:17,970 - INFO -   Layer 27: acc=0.896 [0.876, 0.913] p=0.0000 *
2026-01-27 22:59:17,971 - INFO - Probing feature: sqft_p1_larger
2026-01-27 22:59:22,718 - INFO -   Layer 0: acc=0.627 [0.597, 0.656] p=0.0000 *
2026-01-27 22:59:28,080 - INFO -   Layer 1: acc=0.630 [0.600, 0.659] p=0.0000 *
2026-01-27 22:59:32,873 - INFO -   Layer 2: acc=0.641 [0.612, 0.670] p=0.0000 *
2026-01-27 22:59:38,651 - INFO -   Layer 3: acc=0.685 [0.656, 0.713] p=0.0000 *
2026-01-27 22:59:43,942 - INFO -   Layer 4: acc=0.669 [0.639, 0.697] p=0.0000 *
2026-01-27 22:59:49,565 - INFO -   Layer 5: acc=0.683 [0.654, 0.711] p=0.0000 *
2026-01-27 22:59:55,102 - INFO -   Layer 6: acc=0.682 [0.653, 0.710] p=0.0000 *
2026-01-27 23:00:00,675 - INFO -   Layer 7: acc=0.686 [0.657, 0.714] p=0.0000 *
2026-01-27 23:00:06,475 - INFO -   Layer 8: acc=0.704 [0.675, 0.731] p=0.0000 *
2026-01-27 23:00:12,101 - INFO -   Layer 9: acc=0.699 [0.670, 0.726] p=0.0000 *
2026-01-27 23:00:17,839 - INFO -   Layer 10: acc=0.737 [0.709, 0.763] p=0.0000 *
2026-01-27 23:00:23,522 - INFO -   Layer 11: acc=0.767 [0.740, 0.792] p=0.0000 *
2026-01-27 23:00:29,047 - INFO -   Layer 12: acc=0.824 [0.799, 0.846] p=0.0000 *
2026-01-27 23:00:34,601 - INFO -   Layer 13: acc=0.835 [0.811, 0.857] p=0.0000 *
2026-01-27 23:00:40,271 - INFO -   Layer 14: acc=0.862 [0.839, 0.881] p=0.0000 *
2026-01-27 23:00:46,142 - INFO -   Layer 15: acc=0.869 [0.847, 0.889] p=0.0000 *
2026-01-27 23:00:51,819 - INFO -   Layer 16: acc=0.858 [0.835, 0.878] p=0.0000 *
2026-01-27 23:00:57,485 - INFO -   Layer 17: acc=0.845 [0.822, 0.866] p=0.0000 *
2026-01-27 23:01:03,232 - INFO -   Layer 18: acc=0.852 [0.829, 0.872] p=0.0000 *
2026-01-27 23:01:08,958 - INFO -   Layer 19: acc=0.828 [0.804, 0.850] p=0.0000 *
2026-01-27 23:01:14,733 - INFO -   Layer 20: acc=0.837 [0.813, 0.859] p=0.0000 *
2026-01-27 23:01:20,385 - INFO -   Layer 21: acc=0.821 [0.796, 0.843] p=0.0000 *
2026-01-27 23:01:26,083 - INFO -   Layer 22: acc=0.824 [0.799, 0.846] p=0.0000 *
2026-01-27 23:01:31,644 - INFO -   Layer 23: acc=0.835 [0.811, 0.857] p=0.0000 *
2026-01-27 23:01:37,340 - INFO -   Layer 24: acc=0.829 [0.805, 0.851] p=0.0000 *
2026-01-27 23:01:43,035 - INFO -   Layer 25: acc=0.831 [0.807, 0.853] p=0.0000 *
2026-01-27 23:01:48,507 - INFO -   Layer 26: acc=0.833 [0.809, 0.855] p=0.0000 *
2026-01-27 23:01:54,202 - INFO -   Layer 27: acc=0.813 [0.788, 0.836] p=0.0000 *
2026-01-27 23:01:54,203 - INFO - Probing feature: lot_p1_larger
2026-01-27 23:01:59,962 - INFO -   Layer 0: acc=0.636 [0.607, 0.665] p=0.0000 *
2026-01-27 23:02:05,617 - INFO -   Layer 1: acc=0.649 [0.619, 0.678] p=0.0000 *
2026-01-27 23:02:11,171 - INFO -   Layer 2: acc=0.665 [0.635, 0.693] p=0.0000 *
2026-01-27 23:02:16,934 - INFO -   Layer 3: acc=0.692 [0.663, 0.719] p=0.0000 *
2026-01-27 23:02:22,706 - INFO -   Layer 4: acc=0.703 [0.674, 0.730] p=0.0000 *
2026-01-27 23:02:28,449 - INFO -   Layer 5: acc=0.684 [0.655, 0.712] p=0.0000 *
2026-01-27 23:02:34,200 - INFO -   Layer 6: acc=0.685 [0.656, 0.713] p=0.0000 *
2026-01-27 23:02:39,862 - INFO -   Layer 7: acc=0.690 [0.661, 0.718] p=0.0000 *
2026-01-27 23:02:45,591 - INFO -   Layer 8: acc=0.709 [0.680, 0.736] p=0.0000 *
2026-01-27 23:02:51,366 - INFO -   Layer 9: acc=0.704 [0.675, 0.731] p=0.0000 *
2026-01-27 23:02:57,108 - INFO -   Layer 10: acc=0.722 [0.694, 0.749] p=0.0000 *
2026-01-27 23:03:02,929 - INFO -   Layer 11: acc=0.773 [0.746, 0.797] p=0.0000 *
2026-01-27 23:03:08,617 - INFO -   Layer 12: acc=0.836 [0.812, 0.858] p=0.0000 *
2026-01-27 23:03:14,427 - INFO -   Layer 13: acc=0.830 [0.806, 0.852] p=0.0000 *
2026-01-27 23:03:20,176 - INFO -   Layer 14: acc=0.861 [0.838, 0.880] p=0.0000 *
2026-01-27 23:03:25,947 - INFO -   Layer 15: acc=0.869 [0.847, 0.889] p=0.0000 *
2026-01-27 23:03:31,739 - INFO -   Layer 16: acc=0.863 [0.840, 0.882] p=0.0000 *
2026-01-27 23:03:37,412 - INFO -   Layer 17: acc=0.853 [0.830, 0.873] p=0.0000 *
2026-01-27 23:03:43,118 - INFO -   Layer 18: acc=0.844 [0.821, 0.865] p=0.0000 *
2026-01-27 23:03:48,821 - INFO -   Layer 19: acc=0.851 [0.828, 0.871] p=0.0000 *
2026-01-27 23:03:54,419 - INFO -   Layer 20: acc=0.836 [0.812, 0.858] p=0.0000 *
2026-01-27 23:04:00,069 - INFO -   Layer 21: acc=0.821 [0.796, 0.843] p=0.0000 *
2026-01-27 23:04:05,715 - INFO -   Layer 22: acc=0.820 [0.795, 0.842] p=0.0000 *
2026-01-27 23:04:11,445 - INFO -   Layer 23: acc=0.834 [0.810, 0.856] p=0.0000 *
2026-01-27 23:04:17,036 - INFO -   Layer 24: acc=0.831 [0.807, 0.853] p=0.0000 *
2026-01-27 23:04:22,685 - INFO -   Layer 25: acc=0.841 [0.817, 0.862] p=0.0000 *
2026-01-27 23:04:28,443 - INFO -   Layer 26: acc=0.832 [0.808, 0.854] p=0.0000 *
2026-01-27 23:04:33,991 - INFO -   Layer 27: acc=0.814 [0.789, 0.836] p=0.0000 *
2026-01-27 23:04:33,992 - INFO - Probing feature: year_p1_newer
2026-01-27 23:04:39,889 - INFO -   Layer 0: acc=0.688 [0.659, 0.716] p=0.0000 *
2026-01-27 23:04:45,167 - INFO -   Layer 1: acc=0.700 [0.671, 0.727] p=0.0000 *
2026-01-27 23:04:50,775 - INFO -   Layer 2: acc=0.760 [0.733, 0.785] p=0.0000 *
2026-01-27 23:04:56,613 - INFO -   Layer 3: acc=0.747 [0.719, 0.772] p=0.0000 *
2026-01-27 23:05:02,360 - INFO -   Layer 4: acc=0.779 [0.752, 0.803] p=0.0000 *
2026-01-27 23:05:08,012 - INFO -   Layer 5: acc=0.750 [0.722, 0.775] p=0.0000 *
2026-01-27 23:05:13,792 - INFO -   Layer 6: acc=0.756 [0.729, 0.782] p=0.0000 *
2026-01-27 23:05:19,437 - INFO -   Layer 7: acc=0.783 [0.756, 0.807] p=0.0000 *
2026-01-27 23:05:25,166 - INFO -   Layer 8: acc=0.849 [0.826, 0.870] p=0.0000 *
2026-01-27 23:05:30,984 - INFO -   Layer 9: acc=0.845 [0.822, 0.866] p=0.0000 *
2026-01-27 23:05:36,698 - INFO -   Layer 10: acc=0.863 [0.840, 0.882] p=0.0000 *
2026-01-27 23:05:42,703 - INFO -   Layer 11: acc=0.917 [0.899, 0.933] p=0.0000 *
2026-01-27 23:05:47,767 - INFO -   Layer 12: acc=0.945 [0.930, 0.958] p=0.0000 *
2026-01-27 23:05:52,727 - INFO -   Layer 13: acc=0.958 [0.944, 0.969] p=0.0000 *
2026-01-27 23:05:57,753 - INFO -   Layer 14: acc=0.952 [0.937, 0.964] p=0.0000 *
2026-01-27 23:06:02,564 - INFO -   Layer 15: acc=0.959 [0.945, 0.970] p=0.0000 *
2026-01-27 23:06:07,552 - INFO -   Layer 16: acc=0.953 [0.939, 0.965] p=0.0000 *
2026-01-27 23:06:13,095 - INFO -   Layer 17: acc=0.952 [0.937, 0.964] p=0.0000 *
2026-01-27 23:06:18,203 - INFO -   Layer 18: acc=0.946 [0.931, 0.959] p=0.0000 *
2026-01-27 23:06:23,831 - INFO -   Layer 19: acc=0.941 [0.924, 0.953] p=0.0000 *
2026-01-27 23:06:29,311 - INFO -   Layer 20: acc=0.945 [0.930, 0.958] p=0.0000 *
2026-01-27 23:06:34,768 - INFO -   Layer 21: acc=0.944 [0.929, 0.957] p=0.0000 *
2026-01-27 23:06:40,094 - INFO -   Layer 22: acc=0.939 [0.922, 0.952] p=0.0000 *
2026-01-27 23:06:45,568 - INFO -   Layer 23: acc=0.952 [0.937, 0.964] p=0.0000 *
2026-01-27 23:06:50,565 - INFO -   Layer 24: acc=0.943 [0.928, 0.956] p=0.0000 *
2026-01-27 23:06:55,608 - INFO -   Layer 25: acc=0.948 [0.933, 0.960] p=0.0000 *
2026-01-27 23:07:00,877 - INFO -   Layer 26: acc=0.952 [0.937, 0.964] p=0.0000 *
2026-01-27 23:07:06,187 - INFO -   Layer 27: acc=0.952 [0.937, 0.964] p=0.0000 *
2026-01-27 23:07:06,188 - INFO - Probing feature: price_p1_higher
2026-01-27 23:07:11,742 - INFO -   Layer 0: acc=0.559 [0.529, 0.590] p=0.0001 *
2026-01-27 23:07:27,078 - INFO -   Layer 3: acc=0.573 [0.543, 0.603] p=0.0000 *
2026-01-27 23:07:32,816 - INFO -   Layer 4: acc=0.563 [0.533, 0.593] p=0.0000 *
2026-01-27 23:07:54,837 - INFO -   Layer 8: acc=0.566 [0.536, 0.596] p=0.0000 *
2026-01-27 23:08:04,731 - INFO -   Layer 10: acc=0.558 [0.528, 0.589] p=0.0001 *
2026-01-27 23:08:10,310 - INFO -   Layer 11: acc=0.594 [0.563, 0.623] p=0.0000 *
2026-01-27 23:08:16,119 - INFO -   Layer 12: acc=0.580 [0.549, 0.610] p=0.0000 *
2026-01-27 23:08:21,844 - INFO -   Layer 13: acc=0.593 [0.562, 0.622] p=0.0000 *
2026-01-27 23:08:26,892 - INFO -   Layer 14: acc=0.593 [0.562, 0.622] p=0.0000 *
2026-01-27 23:08:31,841 - INFO -   Layer 15: acc=0.589 [0.558, 0.618] p=0.0000 *
2026-01-27 23:08:36,066 - INFO -   Layer 16: acc=0.572 [0.542, 0.602] p=0.0000 *
2026-01-27 23:08:40,276 - INFO -   Layer 17: acc=0.570 [0.540, 0.600] p=0.0000 *
2026-01-27 23:08:46,163 - INFO -   Layer 18: acc=0.598 [0.568, 0.628] p=0.0000 *
2026-01-27 23:08:51,845 - INFO -   Layer 19: acc=0.607 [0.577, 0.637] p=0.0000 *
2026-01-27 23:08:56,780 - INFO -   Layer 20: acc=0.599 [0.569, 0.629] p=0.0000 *
2026-01-27 23:09:01,561 - INFO -   Layer 21: acc=0.599 [0.569, 0.629] p=0.0000 *
2026-01-27 23:09:06,587 - INFO -   Layer 22: acc=0.603 [0.573, 0.633] p=0.0000 *
2026-01-27 23:09:11,547 - INFO -   Layer 23: acc=0.599 [0.569, 0.629] p=0.0000 *
2026-01-27 23:09:16,339 - INFO -   Layer 24: acc=0.600 [0.570, 0.630] p=0.0000 *
2026-01-27 23:09:22,167 - INFO -   Layer 25: acc=0.597 [0.567, 0.627] p=0.0000 *
2026-01-27 23:09:27,243 - INFO -   Layer 26: acc=0.596 [0.565, 0.625] p=0.0000 *
2026-01-27 23:09:33,025 - INFO -   Layer 27: acc=0.604 [0.574, 0.634] p=0.0000 *
2026-01-27 23:09:33,028 - INFO - Exporting results to CSV...
2026-01-27 23:09:33,067 - INFO - 
============================================================
2026-01-27 23:09:33,067 - INFO - SUMMARY
2026-01-27 23:09:33,067 - INFO - ============================================================
2026-01-27 23:09:33,067 - INFO - 
Best Layer per Feature (Test Set):
2026-01-27 23:09:33,068 - INFO -   bathrooms_p1_more:
2026-01-27 23:09:33,068 - INFO -     Layer 15: acc=0.902 [0.882, 0.918] AUC=0.942 p=0.0000 *
2026-01-27 23:09:33,068 - INFO -   bedrooms_p1_more:
2026-01-27 23:09:33,068 - INFO -     Layer 15: acc=0.910 [0.891, 0.926] AUC=0.961 p=0.0000 *
2026-01-27 23:09:33,069 - INFO -   sqft_p1_larger:
2026-01-27 23:09:33,069 - INFO -     Layer 15: acc=0.869 [0.847, 0.889] AUC=0.927 p=0.0000 *
2026-01-27 23:09:33,070 - INFO -   lot_p1_larger:
2026-01-27 23:09:33,070 - INFO -     Layer 15: acc=0.869 [0.847, 0.889] AUC=0.927 p=0.0000 *
2026-01-27 23:09:33,071 - INFO -   year_p1_newer:
2026-01-27 23:09:33,071 - INFO -     Layer 15: acc=0.959 [0.945, 0.970] AUC=0.990 p=0.0000 *
2026-01-27 23:09:33,071 - INFO -   price_p1_higher:
2026-01-27 23:09:33,071 - INFO -     Layer 19: acc=0.607 [0.577, 0.637] AUC=0.628 p=0.0000 *
2026-01-27 23:09:33,072 - INFO - 
Significant probes: 167/168 (99.4%)
2026-01-27 23:09:33,072 - INFO - 
Mean Test Accuracy by Layer (top 5):
2026-01-27 23:09:33,073 - INFO -   Layer 15: 0.850
2026-01-27 23:09:33,073 - INFO -   Layer 14: 0.841
2026-01-27 23:09:33,073 - INFO -   Layer 16: 0.840
2026-01-27 23:09:33,073 - INFO -   Layer 18: 0.835
2026-01-27 23:09:33,073 - INFO -   Layer 17: 0.834
2026-01-27 23:09:33,073 - INFO - 
Results saved to: /home/anshulk/Housing/data/probe_results
