2026-01-27 23:09:37,729 - INFO - Logging to /home/anshulk/Housing/data/probe_results/logs/probe_qwen3-4b_2_fewshot_cot_temp0_20260127_230937.log
2026-01-27 23:09:37,729 - INFO - Loading activations from /home/anshulk/Housing/data/activations/qwen3-4b_2_fewshot_cot_temp0_activations.npz
2026-01-27 23:09:51,115 - INFO - Loaded activations: (5130, 36, 2560)
2026-01-27 23:09:51,116 - INFO - Labels shape: (5130,)
2026-01-27 23:09:51,116 - INFO - Feature labels columns: ['bathrooms_p1_more', 'bedrooms_p1_more', 'year_p1_newer', 'lot_p1_larger', 'sqft_p1_larger', 'price_p1_higher']
2026-01-27 23:09:51,116 - INFO - Model: qwen3-4b
2026-01-27 23:09:51,116 - INFO - Condition: 2_fewshot_cot_temp0
2026-01-27 23:09:51,116 - INFO - Samples: 5130
2026-01-27 23:09:51,116 - INFO - Layers: 36
2026-01-27 23:09:51,116 - INFO - D_model: 2560
2026-01-27 23:09:51,116 - INFO - Features: ['bathrooms_p1_more', 'bedrooms_p1_more', 'sqft_p1_larger', 'lot_p1_larger', 'year_p1_newer', 'price_p1_higher']
2026-01-27 23:09:51,116 - INFO - Split: 70/10/20 (train/val/test)
2026-01-27 23:09:51,116 - INFO - C selection: Validation set (fast mode)
2026-01-27 23:09:51,116 - INFO - GPU acceleration: ENABLED (cuML - full pipeline)
2026-01-27 23:09:51,116 - INFO - Creating stratified train/val/test splits...
2026-01-27 23:09:51,122 - INFO -   Train: 3590 samples
2026-01-27 23:09:51,122 - INFO -   Val: 514 samples
2026-01-27 23:09:51,122 - INFO -   Test: 1026 samples
2026-01-27 23:09:51,126 - INFO - Probing feature: bathrooms_p1_more
2026-01-27 23:09:55,061 - INFO -   Layer 0: acc=0.689 [0.660, 0.717] p=0.0000 *
2026-01-27 23:09:59,147 - INFO -   Layer 1: acc=0.682 [0.653, 0.710] p=0.0000 *
2026-01-27 23:10:02,947 - INFO -   Layer 2: acc=0.683 [0.654, 0.711] p=0.0000 *
2026-01-27 23:10:07,419 - INFO -   Layer 3: acc=0.687 [0.658, 0.715] p=0.0000 *
2026-01-27 23:10:11,719 - INFO -   Layer 4: acc=0.693 [0.664, 0.720] p=0.0000 *
2026-01-27 23:10:15,912 - INFO -   Layer 5: acc=0.693 [0.664, 0.720] p=0.0000 *
2026-01-27 23:10:20,032 - INFO -   Layer 6: acc=0.701 [0.672, 0.728] p=0.0000 *
2026-01-27 23:10:23,230 - INFO -   Layer 7: acc=0.689 [0.660, 0.717] p=0.0000 *
2026-01-27 23:10:28,248 - INFO -   Layer 8: acc=0.712 [0.684, 0.739] p=0.0000 *
2026-01-27 23:10:33,254 - INFO -   Layer 9: acc=0.685 [0.656, 0.713] p=0.0000 *
2026-01-27 23:10:38,342 - INFO -   Layer 10: acc=0.757 [0.730, 0.783] p=0.0000 *
2026-01-27 23:10:43,715 - INFO -   Layer 11: acc=0.761 [0.734, 0.786] p=0.0000 *
2026-01-27 23:10:48,846 - INFO -   Layer 12: acc=0.789 [0.763, 0.813] p=0.0000 *
2026-01-27 23:10:53,977 - INFO -   Layer 13: acc=0.787 [0.760, 0.811] p=0.0000 *
2026-01-27 23:10:58,550 - INFO -   Layer 14: acc=0.797 [0.772, 0.821] p=0.0000 *
2026-01-27 23:11:03,468 - INFO -   Layer 15: acc=0.812 [0.787, 0.835] p=0.0000 *
2026-01-27 23:11:08,579 - INFO -   Layer 16: acc=0.852 [0.829, 0.872] p=0.0000 *
2026-01-27 23:11:13,934 - INFO -   Layer 17: acc=0.866 [0.844, 0.886] p=0.0000 *
2026-01-27 23:11:19,063 - INFO -   Layer 18: acc=0.862 [0.839, 0.881] p=0.0000 *
2026-01-27 23:11:24,252 - INFO -   Layer 19: acc=0.897 [0.877, 0.914] p=0.0000 *
2026-01-27 23:11:28,935 - INFO -   Layer 20: acc=0.884 [0.863, 0.902] p=0.0000 *
2026-01-27 23:11:33,602 - INFO -   Layer 21: acc=0.885 [0.864, 0.903] p=0.0000 *
2026-01-27 23:11:38,723 - INFO -   Layer 22: acc=0.894 [0.873, 0.911] p=0.0000 *
2026-01-27 23:11:43,842 - INFO -   Layer 23: acc=0.889 [0.868, 0.907] p=0.0000 *
2026-01-27 23:11:48,608 - INFO -   Layer 24: acc=0.873 [0.852, 0.892] p=0.0000 *
2026-01-27 23:11:53,448 - INFO -   Layer 25: acc=0.864 [0.841, 0.883] p=0.0000 *
2026-01-27 23:11:58,189 - INFO -   Layer 26: acc=0.857 [0.834, 0.877] p=0.0000 *
2026-01-27 23:12:02,826 - INFO -   Layer 27: acc=0.857 [0.834, 0.877] p=0.0000 *
2026-01-27 23:12:07,996 - INFO -   Layer 28: acc=0.851 [0.828, 0.871] p=0.0000 *
2026-01-27 23:12:13,427 - INFO -   Layer 29: acc=0.846 [0.823, 0.867] p=0.0000 *
2026-01-27 23:12:18,534 - INFO -   Layer 30: acc=0.845 [0.822, 0.866] p=0.0000 *
2026-01-27 23:12:23,640 - INFO -   Layer 31: acc=0.851 [0.828, 0.871] p=0.0000 *
2026-01-27 23:12:28,706 - INFO -   Layer 32: acc=0.860 [0.837, 0.880] p=0.0000 *
2026-01-27 23:12:33,862 - INFO -   Layer 33: acc=0.851 [0.828, 0.871] p=0.0000 *
2026-01-27 23:12:38,924 - INFO -   Layer 34: acc=0.858 [0.835, 0.878] p=0.0000 *
2026-01-27 23:12:43,731 - INFO -   Layer 35: acc=0.840 [0.816, 0.861] p=0.0000 *
2026-01-27 23:12:43,732 - INFO - Probing feature: bedrooms_p1_more
2026-01-27 23:12:47,097 - INFO -   Layer 0: acc=0.686 [0.657, 0.714] p=0.0000 *
2026-01-27 23:12:50,545 - INFO -   Layer 1: acc=0.686 [0.657, 0.714] p=0.0000 *
2026-01-27 23:12:54,042 - INFO -   Layer 2: acc=0.686 [0.657, 0.714] p=0.0000 *
2026-01-27 23:12:59,024 - INFO -   Layer 3: acc=0.694 [0.665, 0.721] p=0.0000 *
2026-01-27 23:13:03,526 - INFO -   Layer 4: acc=0.683 [0.654, 0.711] p=0.0000 *
2026-01-27 23:13:07,897 - INFO -   Layer 5: acc=0.698 [0.669, 0.725] p=0.0000 *
2026-01-27 23:13:12,393 - INFO -   Layer 6: acc=0.697 [0.668, 0.724] p=0.0000 *
2026-01-27 23:13:17,011 - INFO -   Layer 7: acc=0.679 [0.650, 0.707] p=0.0000 *
2026-01-27 23:13:21,720 - INFO -   Layer 8: acc=0.699 [0.670, 0.726] p=0.0000 *
2026-01-27 23:13:25,683 - INFO -   Layer 9: acc=0.690 [0.661, 0.718] p=0.0000 *
2026-01-27 23:13:30,541 - INFO -   Layer 10: acc=0.707 [0.678, 0.734] p=0.0000 *
2026-01-27 23:13:35,699 - INFO -   Layer 11: acc=0.698 [0.669, 0.725] p=0.0000 *
2026-01-27 23:13:40,892 - INFO -   Layer 12: acc=0.738 [0.710, 0.764] p=0.0000 *
2026-01-27 23:13:46,305 - INFO -   Layer 13: acc=0.745 [0.717, 0.770] p=0.0000 *
2026-01-27 23:13:51,067 - INFO -   Layer 14: acc=0.762 [0.735, 0.787] p=0.0000 *
2026-01-27 23:13:56,236 - INFO -   Layer 15: acc=0.778 [0.751, 0.802] p=0.0000 *
2026-01-27 23:14:01,374 - INFO -   Layer 16: acc=0.824 [0.799, 0.846] p=0.0000 *
2026-01-27 23:14:06,504 - INFO -   Layer 17: acc=0.835 [0.811, 0.857] p=0.0000 *
2026-01-27 23:14:11,430 - INFO -   Layer 18: acc=0.873 [0.852, 0.892] p=0.0000 *
2026-01-27 23:14:16,608 - INFO -   Layer 19: acc=0.921 [0.903, 0.936] p=0.0000 *
2026-01-27 23:14:21,390 - INFO -   Layer 20: acc=0.914 [0.896, 0.930] p=0.0000 *
2026-01-27 23:14:25,971 - INFO -   Layer 21: acc=0.910 [0.891, 0.926] p=0.0000 *
2026-01-27 23:14:31,084 - INFO -   Layer 22: acc=0.925 [0.907, 0.940] p=0.0000 *
2026-01-27 23:14:36,255 - INFO -   Layer 23: acc=0.922 [0.904, 0.937] p=0.0000 *
2026-01-27 23:14:41,438 - INFO -   Layer 24: acc=0.904 [0.884, 0.920] p=0.0000 *
2026-01-27 23:14:46,140 - INFO -   Layer 25: acc=0.908 [0.889, 0.925] p=0.0000 *
2026-01-27 23:14:51,274 - INFO -   Layer 26: acc=0.906 [0.887, 0.923] p=0.0000 *
2026-01-27 23:14:56,405 - INFO -   Layer 27: acc=0.906 [0.887, 0.923] p=0.0000 *
2026-01-27 23:15:01,524 - INFO -   Layer 28: acc=0.901 [0.881, 0.917] p=0.0000 *
2026-01-27 23:15:05,932 - INFO -   Layer 29: acc=0.894 [0.873, 0.911] p=0.0000 *
2026-01-27 23:15:10,461 - INFO -   Layer 30: acc=0.892 [0.871, 0.909] p=0.0000 *
2026-01-27 23:15:15,135 - INFO -   Layer 31: acc=0.886 [0.865, 0.904] p=0.0000 *
2026-01-27 23:15:20,219 - INFO -   Layer 32: acc=0.898 [0.878, 0.915] p=0.0000 *
2026-01-27 23:15:25,225 - INFO -   Layer 33: acc=0.905 [0.886, 0.922] p=0.0000 *
2026-01-27 23:15:30,305 - INFO -   Layer 34: acc=0.892 [0.871, 0.909] p=0.0000 *
2026-01-27 23:15:35,332 - INFO -   Layer 35: acc=0.904 [0.884, 0.920] p=0.0000 *
2026-01-27 23:15:35,332 - INFO - Probing feature: sqft_p1_larger
2026-01-27 23:15:40,110 - INFO -   Layer 0: acc=0.594 [0.563, 0.623] p=0.0000 *
2026-01-27 23:15:45,134 - INFO -   Layer 1: acc=0.605 [0.575, 0.635] p=0.0000 *
2026-01-27 23:15:50,114 - INFO -   Layer 2: acc=0.613 [0.583, 0.642] p=0.0000 *
2026-01-27 23:15:54,884 - INFO -   Layer 3: acc=0.630 [0.600, 0.659] p=0.0000 *
2026-01-27 23:15:59,403 - INFO -   Layer 4: acc=0.642 [0.612, 0.671] p=0.0000 *
2026-01-27 23:16:03,589 - INFO -   Layer 5: acc=0.614 [0.584, 0.643] p=0.0000 *
2026-01-27 23:16:07,153 - INFO -   Layer 6: acc=0.588 [0.557, 0.617] p=0.0000 *
2026-01-27 23:16:12,070 - INFO -   Layer 7: acc=0.645 [0.615, 0.674] p=0.0000 *
2026-01-27 23:16:16,657 - INFO -   Layer 8: acc=0.629 [0.599, 0.658] p=0.0000 *
2026-01-27 23:16:21,771 - INFO -   Layer 9: acc=0.637 [0.608, 0.666] p=0.0000 *
2026-01-27 23:16:27,017 - INFO -   Layer 10: acc=0.635 [0.606, 0.664] p=0.0000 *
2026-01-27 23:16:32,315 - INFO -   Layer 11: acc=0.655 [0.625, 0.683] p=0.0000 *
2026-01-27 23:16:37,555 - INFO -   Layer 12: acc=0.634 [0.604, 0.662] p=0.0000 *
2026-01-27 23:16:42,808 - INFO -   Layer 13: acc=0.642 [0.612, 0.671] p=0.0000 *
2026-01-27 23:16:48,012 - INFO -   Layer 14: acc=0.736 [0.708, 0.762] p=0.0000 *
2026-01-27 23:16:53,244 - INFO -   Layer 15: acc=0.766 [0.739, 0.791] p=0.0000 *
2026-01-27 23:16:58,519 - INFO -   Layer 16: acc=0.789 [0.763, 0.813] p=0.0000 *
2026-01-27 23:17:03,767 - INFO -   Layer 17: acc=0.827 [0.803, 0.849] p=0.0000 *
2026-01-27 23:17:08,767 - INFO -   Layer 18: acc=0.855 [0.832, 0.875] p=0.0000 *
2026-01-27 23:17:14,059 - INFO -   Layer 19: acc=0.888 [0.867, 0.906] p=0.0000 *
2026-01-27 23:17:19,247 - INFO -   Layer 20: acc=0.873 [0.852, 0.892] p=0.0000 *
2026-01-27 23:17:24,487 - INFO -   Layer 21: acc=0.861 [0.838, 0.880] p=0.0000 *
2026-01-27 23:17:29,641 - INFO -   Layer 22: acc=0.870 [0.848, 0.890] p=0.0000 *
2026-01-27 23:17:34,327 - INFO -   Layer 23: acc=0.879 [0.858, 0.898] p=0.0000 *
2026-01-27 23:17:39,486 - INFO -   Layer 24: acc=0.875 [0.854, 0.894] p=0.0000 *
2026-01-27 23:17:44,777 - INFO -   Layer 25: acc=0.881 [0.860, 0.899] p=0.0000 *
2026-01-27 23:17:50,041 - INFO -   Layer 26: acc=0.868 [0.846, 0.888] p=0.0000 *
2026-01-27 23:17:55,150 - INFO -   Layer 27: acc=0.865 [0.843, 0.885] p=0.0000 *
2026-01-27 23:18:00,336 - INFO -   Layer 28: acc=0.861 [0.838, 0.880] p=0.0000 *
2026-01-27 23:18:05,568 - INFO -   Layer 29: acc=0.848 [0.825, 0.869] p=0.0000 *
2026-01-27 23:18:10,463 - INFO -   Layer 30: acc=0.844 [0.821, 0.865] p=0.0000 *
2026-01-27 23:18:15,879 - INFO -   Layer 31: acc=0.849 [0.826, 0.870] p=0.0000 *
2026-01-27 23:18:21,122 - INFO -   Layer 32: acc=0.852 [0.829, 0.872] p=0.0000 *
2026-01-27 23:18:26,268 - INFO -   Layer 33: acc=0.844 [0.821, 0.865] p=0.0000 *
2026-01-27 23:18:30,788 - INFO -   Layer 34: acc=0.834 [0.810, 0.856] p=0.0000 *
2026-01-27 23:18:35,923 - INFO -   Layer 35: acc=0.842 [0.819, 0.863] p=0.0000 *
2026-01-27 23:18:35,924 - INFO - Probing feature: lot_p1_larger
2026-01-27 23:18:41,150 - INFO -   Layer 0: acc=0.592 [0.561, 0.621] p=0.0000 *
2026-01-27 23:18:46,473 - INFO -   Layer 1: acc=0.618 [0.588, 0.647] p=0.0000 *
2026-01-27 23:18:51,527 - INFO -   Layer 2: acc=0.625 [0.595, 0.654] p=0.0000 *
2026-01-27 23:18:56,644 - INFO -   Layer 3: acc=0.636 [0.607, 0.665] p=0.0000 *
2026-01-27 23:19:01,566 - INFO -   Layer 4: acc=0.652 [0.622, 0.681] p=0.0000 *
2026-01-27 23:19:06,198 - INFO -   Layer 5: acc=0.620 [0.590, 0.649] p=0.0000 *
2026-01-27 23:19:10,105 - INFO -   Layer 6: acc=0.588 [0.557, 0.617] p=0.0000 *
2026-01-27 23:19:15,117 - INFO -   Layer 7: acc=0.633 [0.603, 0.662] p=0.0000 *
2026-01-27 23:19:19,944 - INFO -   Layer 8: acc=0.627 [0.597, 0.656] p=0.0000 *
2026-01-27 23:19:25,125 - INFO -   Layer 9: acc=0.643 [0.613, 0.672] p=0.0000 *
2026-01-27 23:19:30,412 - INFO -   Layer 10: acc=0.639 [0.610, 0.668] p=0.0000 *
2026-01-27 23:19:35,564 - INFO -   Layer 11: acc=0.651 [0.621, 0.680] p=0.0000 *
2026-01-27 23:19:40,692 - INFO -   Layer 12: acc=0.633 [0.603, 0.662] p=0.0000 *
2026-01-27 23:19:45,986 - INFO -   Layer 13: acc=0.645 [0.615, 0.674] p=0.0000 *
2026-01-27 23:19:50,866 - INFO -   Layer 14: acc=0.711 [0.682, 0.737] p=0.0000 *
2026-01-27 23:19:56,088 - INFO -   Layer 15: acc=0.761 [0.734, 0.786] p=0.0000 *
2026-01-27 23:20:01,255 - INFO -   Layer 16: acc=0.800 [0.775, 0.824] p=0.0000 *
2026-01-27 23:20:06,517 - INFO -   Layer 17: acc=0.830 [0.806, 0.852] p=0.0000 *
2026-01-27 23:20:11,994 - INFO -   Layer 18: acc=0.865 [0.842, 0.884] p=0.0000 *
2026-01-27 23:20:17,092 - INFO -   Layer 19: acc=0.886 [0.865, 0.904] p=0.0000 *
2026-01-27 23:20:22,281 - INFO -   Layer 20: acc=0.872 [0.851, 0.891] p=0.0000 *
2026-01-27 23:20:27,440 - INFO -   Layer 21: acc=0.861 [0.838, 0.880] p=0.0000 *
2026-01-27 23:20:32,656 - INFO -   Layer 22: acc=0.871 [0.849, 0.890] p=0.0000 *
2026-01-27 23:20:37,907 - INFO -   Layer 23: acc=0.888 [0.867, 0.906] p=0.0000 *
2026-01-27 23:20:43,468 - INFO -   Layer 24: acc=0.876 [0.855, 0.895] p=0.0000 *
2026-01-27 23:20:48,684 - INFO -   Layer 25: acc=0.886 [0.865, 0.904] p=0.0000 *
2026-01-27 23:20:53,963 - INFO -   Layer 26: acc=0.869 [0.847, 0.889] p=0.0000 *
2026-01-27 23:20:59,179 - INFO -   Layer 27: acc=0.862 [0.839, 0.881] p=0.0000 *
2026-01-27 23:21:04,301 - INFO -   Layer 28: acc=0.862 [0.839, 0.881] p=0.0000 *
2026-01-27 23:21:09,538 - INFO -   Layer 29: acc=0.850 [0.827, 0.870] p=0.0000 *
2026-01-27 23:21:14,827 - INFO -   Layer 30: acc=0.849 [0.826, 0.870] p=0.0000 *
2026-01-27 23:21:19,956 - INFO -   Layer 31: acc=0.845 [0.822, 0.866] p=0.0000 *
2026-01-27 23:21:25,149 - INFO -   Layer 32: acc=0.853 [0.830, 0.873] p=0.0000 *
2026-01-27 23:21:30,350 - INFO -   Layer 33: acc=0.846 [0.823, 0.867] p=0.0000 *
2026-01-27 23:21:34,805 - INFO -   Layer 34: acc=0.831 [0.807, 0.853] p=0.0000 *
2026-01-27 23:21:39,967 - INFO -   Layer 35: acc=0.851 [0.828, 0.871] p=0.0000 *
2026-01-27 23:21:39,968 - INFO - Probing feature: year_p1_newer
2026-01-27 23:21:45,244 - INFO -   Layer 0: acc=0.570 [0.540, 0.600] p=0.0000 *
2026-01-27 23:21:50,271 - INFO -   Layer 1: acc=0.568 [0.538, 0.598] p=0.0000 *
2026-01-27 23:21:54,269 - INFO -   Layer 2: acc=0.561 [0.531, 0.591] p=0.0000 *
2026-01-27 23:21:59,262 - INFO -   Layer 3: acc=0.590 [0.559, 0.619] p=0.0000 *
2026-01-27 23:22:04,271 - INFO -   Layer 4: acc=0.607 [0.577, 0.637] p=0.0000 *
2026-01-27 23:22:08,711 - INFO -   Layer 5: acc=0.588 [0.557, 0.617] p=0.0000 *
2026-01-27 23:22:13,942 - INFO -   Layer 6: acc=0.611 [0.581, 0.640] p=0.0000 *
2026-01-27 23:22:18,487 - INFO -   Layer 7: acc=0.604 [0.574, 0.634] p=0.0000 *
2026-01-27 23:22:23,537 - INFO -   Layer 8: acc=0.616 [0.586, 0.645] p=0.0000 *
2026-01-27 23:22:28,515 - INFO -   Layer 9: acc=0.633 [0.603, 0.662] p=0.0000 *
2026-01-27 23:22:33,762 - INFO -   Layer 10: acc=0.699 [0.670, 0.726] p=0.0000 *
2026-01-27 23:22:38,907 - INFO -   Layer 11: acc=0.683 [0.654, 0.711] p=0.0000 *
2026-01-27 23:22:44,352 - INFO -   Layer 12: acc=0.723 [0.695, 0.750] p=0.0000 *
2026-01-27 23:22:49,519 - INFO -   Layer 13: acc=0.727 [0.699, 0.753] p=0.0000 *
2026-01-27 23:22:54,667 - INFO -   Layer 14: acc=0.773 [0.746, 0.797] p=0.0000 *
2026-01-27 23:22:59,854 - INFO -   Layer 15: acc=0.818 [0.793, 0.840] p=0.0000 *
2026-01-27 23:23:04,804 - INFO -   Layer 16: acc=0.848 [0.825, 0.869] p=0.0000 *
2026-01-27 23:23:09,835 - INFO -   Layer 17: acc=0.873 [0.852, 0.892] p=0.0000 *
2026-01-27 23:23:15,216 - INFO -   Layer 18: acc=0.896 [0.876, 0.913] p=0.0000 *
2026-01-27 23:23:20,397 - INFO -   Layer 19: acc=0.935 [0.918, 0.948] p=0.0000 *
2026-01-27 23:23:25,683 - INFO -   Layer 20: acc=0.920 [0.902, 0.935] p=0.0000 *
2026-01-27 23:23:30,568 - INFO -   Layer 21: acc=0.936 [0.919, 0.949] p=0.0000 *
2026-01-27 23:23:35,573 - INFO -   Layer 22: acc=0.939 [0.922, 0.952] p=0.0000 *
2026-01-27 23:23:41,142 - INFO -   Layer 23: acc=0.947 [0.932, 0.959] p=0.0000 *
2026-01-27 23:23:46,395 - INFO -   Layer 24: acc=0.940 [0.923, 0.953] p=0.0000 *
2026-01-27 23:23:51,239 - INFO -   Layer 25: acc=0.924 [0.906, 0.939] p=0.0000 *
2026-01-27 23:23:56,521 - INFO -   Layer 26: acc=0.903 [0.883, 0.919] p=0.0000 *
2026-01-27 23:24:01,258 - INFO -   Layer 27: acc=0.914 [0.896, 0.930] p=0.0000 *
2026-01-27 23:24:06,166 - INFO -   Layer 28: acc=0.907 [0.888, 0.924] p=0.0000 *
2026-01-27 23:24:11,136 - INFO -   Layer 29: acc=0.899 [0.879, 0.916] p=0.0000 *
2026-01-27 23:24:16,238 - INFO -   Layer 30: acc=0.899 [0.879, 0.916] p=0.0000 *
2026-01-27 23:24:21,303 - INFO -   Layer 31: acc=0.904 [0.885, 0.921] p=0.0000 *
2026-01-27 23:24:26,479 - INFO -   Layer 32: acc=0.900 [0.880, 0.917] p=0.0000 *
2026-01-27 23:24:31,604 - INFO -   Layer 33: acc=0.887 [0.866, 0.905] p=0.0000 *
2026-01-27 23:24:36,753 - INFO -   Layer 34: acc=0.886 [0.865, 0.904] p=0.0000 *
2026-01-27 23:24:41,467 - INFO -   Layer 35: acc=0.889 [0.868, 0.907] p=0.0000 *
2026-01-27 23:24:41,468 - INFO - Probing feature: price_p1_higher
2026-01-27 23:25:48,576 - INFO -   Layer 13: acc=0.556 [0.525, 0.586] p=0.0002 *
2026-01-27 23:25:53,877 - INFO -   Layer 14: acc=0.557 [0.526, 0.587] p=0.0002 *
2026-01-27 23:25:59,134 - INFO -   Layer 15: acc=0.577 [0.547, 0.607] p=0.0000 *
2026-01-27 23:26:03,372 - INFO -   Layer 16: acc=0.552 [0.521, 0.582] p=0.0005 *
2026-01-27 23:26:08,527 - INFO -   Layer 17: acc=0.564 [0.534, 0.594] p=0.0000 *
2026-01-27 23:26:13,886 - INFO -   Layer 18: acc=0.558 [0.527, 0.588] p=0.0001 *
2026-01-27 23:26:17,586 - INFO -   Layer 19: acc=0.573 [0.543, 0.603] p=0.0000 *
2026-01-27 23:26:22,632 - INFO -   Layer 20: acc=0.569 [0.539, 0.599] p=0.0000 *
2026-01-27 23:26:26,721 - INFO -   Layer 21: acc=0.566 [0.536, 0.596] p=0.0000 *
2026-01-27 23:26:30,458 - INFO -   Layer 22: acc=0.567 [0.537, 0.597] p=0.0000 *
2026-01-27 23:26:34,138 - INFO -   Layer 23: acc=0.582 [0.551, 0.612] p=0.0000 *
2026-01-27 23:26:37,916 - INFO -   Layer 24: acc=0.582 [0.551, 0.612] p=0.0000 *
2026-01-27 23:26:42,013 - INFO -   Layer 25: acc=0.571 [0.541, 0.601] p=0.0000 *
2026-01-27 23:26:46,235 - INFO -   Layer 26: acc=0.576 [0.546, 0.606] p=0.0000 *
2026-01-27 23:26:50,343 - INFO -   Layer 27: acc=0.568 [0.538, 0.598] p=0.0000 *
2026-01-27 23:26:54,029 - INFO -   Layer 28: acc=0.566 [0.536, 0.596] p=0.0000 *
2026-01-27 23:26:57,658 - INFO -   Layer 29: acc=0.569 [0.539, 0.599] p=0.0000 *
2026-01-27 23:27:02,392 - INFO -   Layer 30: acc=0.583 [0.552, 0.613] p=0.0000 *
2026-01-27 23:27:06,481 - INFO -   Layer 31: acc=0.579 [0.548, 0.609] p=0.0000 *
2026-01-27 23:27:10,655 - INFO -   Layer 32: acc=0.563 [0.533, 0.593] p=0.0000 *
2026-01-27 23:27:14,805 - INFO -   Layer 33: acc=0.566 [0.536, 0.596] p=0.0000 *
2026-01-27 23:27:18,807 - INFO -   Layer 34: acc=0.586 [0.555, 0.616] p=0.0000 *
2026-01-27 23:27:23,714 - INFO -   Layer 35: acc=0.567 [0.537, 0.597] p=0.0000 *
2026-01-27 23:27:23,718 - INFO - Exporting results to CSV...
2026-01-27 23:27:23,754 - INFO - 
============================================================
2026-01-27 23:27:23,754 - INFO - SUMMARY
2026-01-27 23:27:23,754 - INFO - ============================================================
2026-01-27 23:27:23,754 - INFO - 
Best Layer per Feature (Test Set):
2026-01-27 23:27:23,755 - INFO -   bathrooms_p1_more:
2026-01-27 23:27:23,755 - INFO -     Layer 19: acc=0.897 [0.877, 0.914] AUC=0.944 p=0.0000 *
2026-01-27 23:27:23,756 - INFO -   bedrooms_p1_more:
2026-01-27 23:27:23,756 - INFO -     Layer 22: acc=0.925 [0.907, 0.940] AUC=0.959 p=0.0000 *
2026-01-27 23:27:23,757 - INFO -   sqft_p1_larger:
2026-01-27 23:27:23,757 - INFO -     Layer 19: acc=0.888 [0.867, 0.906] AUC=0.943 p=0.0000 *
2026-01-27 23:27:23,757 - INFO -   lot_p1_larger:
2026-01-27 23:27:23,758 - INFO -     Layer 23: acc=0.888 [0.867, 0.906] AUC=0.927 p=0.0000 *
2026-01-27 23:27:23,758 - INFO -   year_p1_newer:
2026-01-27 23:27:23,758 - INFO -     Layer 23: acc=0.947 [0.932, 0.959] AUC=0.969 p=0.0000 *
2026-01-27 23:27:23,759 - INFO -   price_p1_higher:
2026-01-27 23:27:23,759 - INFO -     Layer 34: acc=0.586 [0.555, 0.616] AUC=0.604 p=0.0000 *
2026-01-27 23:27:23,759 - INFO - 
Significant probes: 211/216 (97.7%)
2026-01-27 23:27:23,759 - INFO - 
Mean Test Accuracy by Layer (top 5):
2026-01-27 23:27:23,760 - INFO -   Layer 23: 0.851
2026-01-27 23:27:23,760 - INFO -   Layer 19: 0.850
2026-01-27 23:27:23,760 - INFO -   Layer 22: 0.844
2026-01-27 23:27:23,760 - INFO -   Layer 24: 0.842
2026-01-27 23:27:23,760 - INFO -   Layer 25: 0.839
2026-01-27 23:27:23,761 - INFO - 
Results saved to: /home/anshulk/Housing/data/probe_results
