2026-01-27 22:53:49,682 - INFO - Logging to /home/anshulk/Housing/data/probe_results/logs/probe_llama-3.2-3b_2_fewshot_cot_temp0_20260127_225349.log
2026-01-27 22:53:49,682 - INFO - Loading activations from /home/anshulk/Housing/data/activations/llama-3.2-3b_2_fewshot_cot_temp0_activations.npz
2026-01-27 22:54:01,900 - INFO - Loaded activations: (5130, 28, 3072)
2026-01-27 22:54:01,900 - INFO - Labels shape: (5130,)
2026-01-27 22:54:01,900 - INFO - Feature labels columns: ['bathrooms_p1_more', 'bedrooms_p1_more', 'year_p1_newer', 'lot_p1_larger', 'sqft_p1_larger', 'price_p1_higher']
2026-01-27 22:54:01,900 - INFO - Model: llama-3.2-3b
2026-01-27 22:54:01,900 - INFO - Condition: 2_fewshot_cot_temp0
2026-01-27 22:54:01,900 - INFO - Samples: 5130
2026-01-27 22:54:01,900 - INFO - Layers: 28
2026-01-27 22:54:01,900 - INFO - D_model: 3072
2026-01-27 22:54:01,900 - INFO - Features: ['bathrooms_p1_more', 'bedrooms_p1_more', 'sqft_p1_larger', 'lot_p1_larger', 'year_p1_newer', 'price_p1_higher']
2026-01-27 22:54:01,900 - INFO - Split: 70/10/20 (train/val/test)
2026-01-27 22:54:01,900 - INFO - C selection: Validation set (fast mode)
2026-01-27 22:54:01,901 - INFO - GPU acceleration: ENABLED (cuML - full pipeline)
2026-01-27 22:54:01,901 - INFO - Creating stratified train/val/test splits...
2026-01-27 22:54:01,907 - INFO -   Train: 3590 samples
2026-01-27 22:54:01,907 - INFO -   Val: 514 samples
2026-01-27 22:54:01,907 - INFO -   Test: 1026 samples
Probing:   0%|          | 0/168 [00:00<?, ?it/s]2026-01-27 22:54:01,911 - INFO - Probing feature: bathrooms_p1_more
2026-01-27 22:54:11,366 - INFO -   Layer 0: acc=0.704 [0.675, 0.731] p=0.0000 *
Probing:   1%|          | 1/168 [00:09<26:19,  9.46s/it]2026-01-27 22:54:17,166 - INFO -   Layer 1: acc=0.725 [0.697, 0.752] p=0.0000 *
Probing:   1%|          | 2/168 [00:15<20:12,  7.31s/it]2026-01-27 22:54:22,976 - INFO -   Layer 2: acc=0.711 [0.682, 0.737] p=0.0000 *
Probing:   2%|▏         | 3/168 [00:21<18:12,  6.62s/it]2026-01-27 22:54:28,860 - INFO -   Layer 3: acc=0.719 [0.691, 0.746] p=0.0000 *
Probing:   2%|▏         | 4/168 [00:26<17:18,  6.33s/it]2026-01-27 22:54:34,596 - INFO -   Layer 4: acc=0.703 [0.674, 0.730] p=0.0000 *
Probing:   3%|▎         | 5/168 [00:32<16:36,  6.12s/it]2026-01-27 22:54:40,207 - INFO -   Layer 5: acc=0.713 [0.685, 0.740] p=0.0000 *
Probing:   4%|▎         | 6/168 [00:38<16:03,  5.94s/it]2026-01-27 22:54:45,814 - INFO -   Layer 6: acc=0.727 [0.699, 0.753] p=0.0000 *
Probing:   4%|▍         | 7/168 [00:43<15:39,  5.83s/it]2026-01-27 22:54:51,325 - INFO -   Layer 7: acc=0.760 [0.733, 0.785] p=0.0000 *
Probing:   5%|▍         | 8/168 [00:49<15:16,  5.73s/it]2026-01-27 22:54:57,146 - INFO -   Layer 8: acc=0.769 [0.742, 0.794] p=0.0000 *
Probing:   5%|▌         | 9/168 [00:55<15:15,  5.76s/it]2026-01-27 22:55:02,722 - INFO -   Layer 9: acc=0.774 [0.747, 0.798] p=0.0000 *
Probing:   6%|▌         | 10/168 [01:00<15:01,  5.70s/it]2026-01-27 22:55:08,321 - INFO -   Layer 10: acc=0.776 [0.749, 0.800] p=0.0000 *
Probing:   7%|▋         | 11/168 [01:06<14:50,  5.67s/it]2026-01-27 22:55:13,917 - INFO -   Layer 11: acc=0.816 [0.791, 0.838] p=0.0000 *
Probing:   7%|▋         | 12/168 [01:12<14:41,  5.65s/it]2026-01-27 22:55:19,358 - INFO -   Layer 12: acc=0.874 [0.853, 0.893] p=0.0000 *
Probing:   8%|▊         | 13/168 [01:17<14:25,  5.59s/it]2026-01-27 22:55:25,074 - INFO -   Layer 13: acc=0.887 [0.866, 0.905] p=0.0000 *
Probing:   8%|▊         | 14/168 [01:23<14:26,  5.62s/it]2026-01-27 22:55:30,434 - INFO -   Layer 14: acc=0.886 [0.865, 0.904] p=0.0000 *
Probing:   9%|▉         | 15/168 [01:28<14:08,  5.55s/it]2026-01-27 22:55:36,027 - INFO -   Layer 15: acc=0.902 [0.882, 0.918] p=0.0000 *
Probing:  10%|▉         | 16/168 [01:34<14:05,  5.56s/it]2026-01-27 22:55:41,683 - INFO -   Layer 16: acc=0.891 [0.870, 0.908] p=0.0000 *
Probing:  10%|█         | 17/168 [01:39<14:03,  5.59s/it]2026-01-27 22:55:47,258 - INFO -   Layer 17: acc=0.891 [0.870, 0.908] p=0.0000 *
Probing:  11%|█         | 18/168 [01:45<13:57,  5.58s/it]2026-01-27 22:55:52,806 - INFO -   Layer 18: acc=0.884 [0.863, 0.902] p=0.0000 *
Probing:  11%|█▏        | 19/168 [01:50<13:50,  5.57s/it]2026-01-27 22:55:58,300 - INFO -   Layer 19: acc=0.883 [0.862, 0.901] p=0.0000 *
Probing:  12%|█▏        | 20/168 [01:56<13:41,  5.55s/it]2026-01-27 22:56:03,622 - INFO -   Layer 20: acc=0.852 [0.829, 0.872] p=0.0000 *
Probing:  12%|█▎        | 21/168 [02:01<13:25,  5.48s/it]2026-01-27 22:56:09,294 - INFO -   Layer 21: acc=0.868 [0.846, 0.888] p=0.0000 *
Probing:  13%|█▎        | 22/168 [02:07<13:28,  5.54s/it]2026-01-27 22:56:15,051 - INFO -   Layer 22: acc=0.865 [0.843, 0.885] p=0.0000 *
Probing:  14%|█▎        | 23/168 [02:13<13:32,  5.60s/it]2026-01-27 22:56:20,232 - INFO -   Layer 23: acc=0.876 [0.855, 0.895] p=0.0000 *
Probing:  14%|█▍        | 24/168 [02:18<13:08,  5.48s/it]2026-01-27 22:56:25,872 - INFO -   Layer 24: acc=0.875 [0.854, 0.894] p=0.0000 *
Probing:  15%|█▍        | 25/168 [02:23<13:10,  5.53s/it]2026-01-27 22:56:31,419 - INFO -   Layer 25: acc=0.884 [0.863, 0.902] p=0.0000 *
Probing:  15%|█▌        | 26/168 [02:29<13:05,  5.53s/it]2026-01-27 22:56:36,699 - INFO -   Layer 26: acc=0.886 [0.865, 0.904] p=0.0000 *
Probing:  16%|█▌        | 27/168 [02:34<12:49,  5.46s/it]2026-01-27 22:56:42,691 - INFO -   Layer 27: acc=0.875 [0.854, 0.894] p=0.0000 *
Probing:  17%|█▋        | 28/168 [02:40<13:06,  5.62s/it]2026-01-27 22:56:42,692 - INFO - Probing feature: bedrooms_p1_more
2026-01-27 22:56:48,314 - INFO -   Layer 0: acc=0.699 [0.670, 0.726] p=0.0000 *
Probing:  17%|█▋        | 29/168 [02:46<13:01,  5.62s/it]2026-01-27 22:56:54,026 - INFO -   Layer 1: acc=0.719 [0.691, 0.746] p=0.0000 *
Probing:  18%|█▊        | 30/168 [02:52<12:59,  5.65s/it]2026-01-27 22:56:59,836 - INFO -   Layer 2: acc=0.765 [0.738, 0.790] p=0.0000 *
Probing:  18%|█▊        | 31/168 [02:57<13:00,  5.70s/it]2026-01-27 22:57:05,500 - INFO -   Layer 3: acc=0.755 [0.728, 0.781] p=0.0000 *
Probing:  19%|█▉        | 32/168 [03:03<12:53,  5.69s/it]2026-01-27 22:57:10,774 - INFO -   Layer 4: acc=0.741 [0.713, 0.767] p=0.0000 *
Probing:  20%|█▉        | 33/168 [03:08<12:30,  5.56s/it]2026-01-27 22:57:16,787 - INFO -   Layer 5: acc=0.729 [0.701, 0.755] p=0.0000 *
Probing:  20%|██        | 34/168 [03:14<12:43,  5.70s/it]2026-01-27 22:57:22,331 - INFO -   Layer 6: acc=0.759 [0.732, 0.784] p=0.0000 *
Probing:  21%|██        | 35/168 [03:20<12:31,  5.65s/it]2026-01-27 22:57:27,854 - INFO -   Layer 7: acc=0.782 [0.755, 0.806] p=0.0000 *
Probing:  21%|██▏       | 36/168 [03:25<12:20,  5.61s/it]2026-01-27 22:57:33,306 - INFO -   Layer 8: acc=0.771 [0.744, 0.796] p=0.0000 *
Probing:  22%|██▏       | 37/168 [03:31<12:08,  5.56s/it]2026-01-27 22:57:38,979 - INFO -   Layer 9: acc=0.790 [0.764, 0.814] p=0.0000 *
Probing:  23%|██▎       | 38/168 [03:37<12:07,  5.60s/it]2026-01-27 22:57:44,753 - INFO -   Layer 10: acc=0.811 [0.786, 0.834] p=0.0000 *
Probing:  23%|██▎       | 39/168 [03:42<12:08,  5.65s/it]2026-01-27 22:57:50,360 - INFO -   Layer 11: acc=0.840 [0.816, 0.861] p=0.0000 *
Probing:  24%|██▍       | 40/168 [03:48<12:01,  5.64s/it]2026-01-27 22:57:55,925 - INFO -   Layer 12: acc=0.876 [0.855, 0.895] p=0.0000 *
Probing:  24%|██▍       | 41/168 [03:54<11:53,  5.62s/it]2026-01-27 22:58:01,498 - INFO -   Layer 13: acc=0.902 [0.882, 0.918] p=0.0000 *
Probing:  25%|██▌       | 42/168 [03:59<11:45,  5.60s/it]2026-01-27 22:58:06,743 - INFO -   Layer 14: acc=0.893 [0.872, 0.910] p=0.0000 *
Probing:  26%|██▌       | 43/168 [04:04<11:26,  5.50s/it]2026-01-27 22:58:12,617 - INFO -   Layer 15: acc=0.910 [0.891, 0.926] p=0.0000 *
Probing:  26%|██▌       | 44/168 [04:10<11:35,  5.61s/it]2026-01-27 22:58:18,217 - INFO -   Layer 16: acc=0.904 [0.884, 0.920] p=0.0000 *
Probing:  27%|██▋       | 45/168 [04:16<11:29,  5.61s/it]2026-01-27 22:58:23,523 - INFO -   Layer 17: acc=0.896 [0.876, 0.913] p=0.0000 *
Probing:  27%|██▋       | 46/168 [04:21<11:12,  5.52s/it]2026-01-27 22:58:28,532 - INFO -   Layer 18: acc=0.886 [0.865, 0.904] p=0.0000 *
Probing:  28%|██▊       | 47/168 [04:26<10:49,  5.36s/it]2026-01-27 22:58:33,910 - INFO -   Layer 19: acc=0.894 [0.873, 0.911] p=0.0000 *
Probing:  29%|██▊       | 48/168 [04:32<10:44,  5.37s/it]2026-01-27 22:58:39,475 - INFO -   Layer 20: acc=0.886 [0.865, 0.904] p=0.0000 *
Probing:  29%|██▉       | 49/168 [04:37<10:45,  5.43s/it]2026-01-27 22:58:44,858 - INFO -   Layer 21: acc=0.876 [0.855, 0.895] p=0.0000 *
Probing:  30%|██▉       | 50/168 [04:42<10:38,  5.41s/it]2026-01-27 22:58:50,439 - INFO -   Layer 22: acc=0.883 [0.862, 0.901] p=0.0000 *
Probing:  30%|███       | 51/168 [04:48<10:39,  5.46s/it]2026-01-27 22:58:56,071 - INFO -   Layer 23: acc=0.890 [0.869, 0.908] p=0.0000 *
Probing:  31%|███       | 52/168 [04:54<10:39,  5.51s/it]2026-01-27 22:59:01,445 - INFO -   Layer 24: acc=0.887 [0.866, 0.905] p=0.0000 *
Probing:  32%|███▏      | 53/168 [04:59<10:29,  5.47s/it]2026-01-27 22:59:07,038 - INFO -   Layer 25: acc=0.888 [0.867, 0.906] p=0.0000 *
Probing:  32%|███▏      | 54/168 [05:05<10:27,  5.51s/it]2026-01-27 22:59:12,208 - INFO -   Layer 26: acc=0.898 [0.878, 0.915] p=0.0000 *
Probing:  33%|███▎      | 55/168 [05:10<10:11,  5.41s/it]2026-01-27 22:59:17,970 - INFO -   Layer 27: acc=0.896 [0.876, 0.913] p=0.0000 *
Probing:  33%|███▎      | 56/168 [05:16<10:17,  5.51s/it]2026-01-27 22:59:17,971 - INFO - Probing feature: sqft_p1_larger
2026-01-27 22:59:22,718 - INFO -   Layer 0: acc=0.627 [0.597, 0.656] p=0.0000 *
Probing:  34%|███▍      | 57/168 [05:20<09:46,  5.28s/it]2026-01-27 22:59:28,080 - INFO -   Layer 1: acc=0.630 [0.600, 0.659] p=0.0000 *
Probing:  35%|███▍      | 58/168 [05:26<09:43,  5.31s/it]2026-01-27 22:59:32,873 - INFO -   Layer 2: acc=0.641 [0.612, 0.670] p=0.0000 *
Probing:  35%|███▌      | 59/168 [05:30<09:21,  5.15s/it]2026-01-27 22:59:38,651 - INFO -   Layer 3: acc=0.685 [0.656, 0.713] p=0.0000 *
Probing:  36%|███▌      | 60/168 [05:36<09:36,  5.34s/it]2026-01-27 22:59:43,942 - INFO -   Layer 4: acc=0.669 [0.639, 0.697] p=0.0000 *
Probing:  36%|███▋      | 61/168 [05:42<09:29,  5.33s/it]2026-01-27 22:59:49,565 - INFO -   Layer 5: acc=0.683 [0.654, 0.711] p=0.0000 *
Probing:  37%|███▋      | 62/168 [05:47<09:33,  5.41s/it]2026-01-27 22:59:55,102 - INFO -   Layer 6: acc=0.682 [0.653, 0.710] p=0.0000 *
Probing:  38%|███▊      | 63/168 [05:53<09:32,  5.45s/it]2026-01-27 23:00:00,675 - INFO -   Layer 7: acc=0.686 [0.657, 0.714] p=0.0000 *
Probing:  38%|███▊      | 64/168 [05:58<09:30,  5.49s/it]2026-01-27 23:00:06,475 - INFO -   Layer 8: acc=0.704 [0.675, 0.731] p=0.0000 *
Probing:  39%|███▊      | 65/168 [06:04<09:34,  5.58s/it]2026-01-27 23:00:12,101 - INFO -   Layer 9: acc=0.699 [0.670, 0.726] p=0.0000 *
Probing:  39%|███▉      | 66/168 [06:10<09:30,  5.59s/it]2026-01-27 23:00:17,839 - INFO -   Layer 10: acc=0.737 [0.709, 0.763] p=0.0000 *
Probing:  40%|███▉      | 67/168 [06:15<09:29,  5.64s/it]2026-01-27 23:00:23,522 - INFO -   Layer 11: acc=0.767 [0.740, 0.792] p=0.0000 *
Probing:  40%|████      | 68/168 [06:21<09:25,  5.65s/it]2026-01-27 23:00:29,047 - INFO -   Layer 12: acc=0.824 [0.799, 0.846] p=0.0000 *
Probing:  41%|████      | 69/168 [06:27<09:15,  5.61s/it]2026-01-27 23:00:34,601 - INFO -   Layer 13: acc=0.835 [0.811, 0.857] p=0.0000 *
Probing:  42%|████▏     | 70/168 [06:32<09:08,  5.60s/it]2026-01-27 23:00:40,271 - INFO -   Layer 14: acc=0.862 [0.839, 0.881] p=0.0000 *
Probing:  42%|████▏     | 71/168 [06:38<09:04,  5.62s/it]2026-01-27 23:00:46,142 - INFO -   Layer 15: acc=0.869 [0.847, 0.889] p=0.0000 *
Probing:  43%|████▎     | 72/168 [06:44<09:06,  5.69s/it]2026-01-27 23:00:51,819 - INFO -   Layer 16: acc=0.858 [0.835, 0.878] p=0.0000 *
Probing:  43%|████▎     | 73/168 [06:49<09:00,  5.69s/it]2026-01-27 23:00:57,485 - INFO -   Layer 17: acc=0.845 [0.822, 0.866] p=0.0000 *
Probing:  44%|████▍     | 74/168 [06:55<08:54,  5.68s/it]2026-01-27 23:01:03,232 - INFO -   Layer 18: acc=0.852 [0.829, 0.872] p=0.0000 *
Probing:  45%|████▍     | 75/168 [07:01<08:50,  5.70s/it]2026-01-27 23:01:08,958 - INFO -   Layer 19: acc=0.828 [0.804, 0.850] p=0.0000 *
Probing:  45%|████▌     | 76/168 [07:07<08:45,  5.71s/it]2026-01-27 23:01:14,733 - INFO -   Layer 20: acc=0.837 [0.813, 0.859] p=0.0000 *
Probing:  46%|████▌     | 77/168 [07:12<08:41,  5.73s/it]2026-01-27 23:01:20,385 - INFO -   Layer 21: acc=0.821 [0.796, 0.843] p=0.0000 *
Probing:  46%|████▋     | 78/168 [07:18<08:33,  5.71s/it]2026-01-27 23:01:26,083 - INFO -   Layer 22: acc=0.824 [0.799, 0.846] p=0.0000 *
Probing:  47%|████▋     | 79/168 [07:24<08:27,  5.70s/it]2026-01-27 23:01:31,644 - INFO -   Layer 23: acc=0.835 [0.811, 0.857] p=0.0000 *
Probing:  48%|████▊     | 80/168 [07:29<08:18,  5.66s/it]2026-01-27 23:01:37,340 - INFO -   Layer 24: acc=0.829 [0.805, 0.851] p=0.0000 *
Probing:  48%|████▊     | 81/168 [07:35<08:13,  5.67s/it]2026-01-27 23:01:43,035 - INFO -   Layer 25: acc=0.831 [0.807, 0.853] p=0.0000 *
Probing:  49%|████▉     | 82/168 [07:41<08:08,  5.68s/it]2026-01-27 23:01:48,507 - INFO -   Layer 26: acc=0.833 [0.809, 0.855] p=0.0000 *
Probing:  49%|████▉     | 83/168 [07:46<07:57,  5.62s/it]2026-01-27 23:01:54,202 - INFO -   Layer 27: acc=0.813 [0.788, 0.836] p=0.0000 *
Probing:  50%|█████     | 84/168 [07:52<07:53,  5.64s/it]2026-01-27 23:01:54,203 - INFO - Probing feature: lot_p1_larger
2026-01-27 23:01:59,962 - INFO -   Layer 0: acc=0.636 [0.607, 0.665] p=0.0000 *
Probing:  51%|█████     | 85/168 [07:58<07:51,  5.68s/it]2026-01-27 23:02:05,617 - INFO -   Layer 1: acc=0.649 [0.619, 0.678] p=0.0000 *
Probing:  51%|█████     | 86/168 [08:03<07:44,  5.67s/it]2026-01-27 23:02:11,171 - INFO -   Layer 2: acc=0.665 [0.635, 0.693] p=0.0000 *
Probing:  52%|█████▏    | 87/168 [08:09<07:36,  5.63s/it]2026-01-27 23:02:16,934 - INFO -   Layer 3: acc=0.692 [0.663, 0.719] p=0.0000 *
Probing:  52%|█████▏    | 88/168 [08:15<07:33,  5.67s/it]2026-01-27 23:02:22,706 - INFO -   Layer 4: acc=0.703 [0.674, 0.730] p=0.0000 *
Probing:  53%|█████▎    | 89/168 [08:20<07:30,  5.70s/it]2026-01-27 23:02:28,449 - INFO -   Layer 5: acc=0.684 [0.655, 0.712] p=0.0000 *
Probing:  54%|█████▎    | 90/168 [08:26<07:25,  5.72s/it]2026-01-27 23:02:34,200 - INFO -   Layer 6: acc=0.685 [0.656, 0.713] p=0.0000 *
Probing:  54%|█████▍    | 91/168 [08:32<07:20,  5.73s/it]2026-01-27 23:02:39,862 - INFO -   Layer 7: acc=0.690 [0.661, 0.718] p=0.0000 *
Probing:  55%|█████▍    | 92/168 [08:37<07:13,  5.71s/it]2026-01-27 23:02:45,591 - INFO -   Layer 8: acc=0.709 [0.680, 0.736] p=0.0000 *
Probing:  55%|█████▌    | 93/168 [08:43<07:08,  5.71s/it]2026-01-27 23:02:51,366 - INFO -   Layer 9: acc=0.704 [0.675, 0.731] p=0.0000 *
Probing:  56%|█████▌    | 94/168 [08:49<07:04,  5.73s/it]2026-01-27 23:02:57,108 - INFO -   Layer 10: acc=0.722 [0.694, 0.749] p=0.0000 *
Probing:  57%|█████▋    | 95/168 [08:55<06:58,  5.73s/it]2026-01-27 23:03:02,929 - INFO -   Layer 11: acc=0.773 [0.746, 0.797] p=0.0000 *
Probing:  57%|█████▋    | 96/168 [09:01<06:54,  5.76s/it]2026-01-27 23:03:08,617 - INFO -   Layer 12: acc=0.836 [0.812, 0.858] p=0.0000 *
Probing:  58%|█████▊    | 97/168 [09:06<06:47,  5.74s/it]2026-01-27 23:03:14,427 - INFO -   Layer 13: acc=0.830 [0.806, 0.852] p=0.0000 *
Probing:  58%|█████▊    | 98/168 [09:12<06:43,  5.76s/it]2026-01-27 23:03:20,176 - INFO -   Layer 14: acc=0.861 [0.838, 0.880] p=0.0000 *
Probing:  59%|█████▉    | 99/168 [09:18<06:37,  5.76s/it]2026-01-27 23:03:25,947 - INFO -   Layer 15: acc=0.869 [0.847, 0.889] p=0.0000 *
Probing:  60%|█████▉    | 100/168 [09:24<06:31,  5.76s/it]2026-01-27 23:03:31,739 - INFO -   Layer 16: acc=0.863 [0.840, 0.882] p=0.0000 *
Probing:  60%|██████    | 101/168 [09:29<06:26,  5.77s/it]2026-01-27 23:03:37,412 - INFO -   Layer 17: acc=0.853 [0.830, 0.873] p=0.0000 *
Probing:  61%|██████    | 102/168 [09:35<06:18,  5.74s/it]2026-01-27 23:03:43,118 - INFO -   Layer 18: acc=0.844 [0.821, 0.865] p=0.0000 *
Probing:  61%|██████▏   | 103/168 [09:41<06:12,  5.73s/it]2026-01-27 23:03:48,821 - INFO -   Layer 19: acc=0.851 [0.828, 0.871] p=0.0000 *
Probing:  62%|██████▏   | 104/168 [09:46<06:06,  5.72s/it]2026-01-27 23:03:54,419 - INFO -   Layer 20: acc=0.836 [0.812, 0.858] p=0.0000 *
Probing:  62%|██████▎   | 105/168 [09:52<05:58,  5.69s/it]2026-01-27 23:04:00,069 - INFO -   Layer 21: acc=0.821 [0.796, 0.843] p=0.0000 *
Probing:  63%|██████▎   | 106/168 [09:58<05:51,  5.67s/it]2026-01-27 23:04:05,715 - INFO -   Layer 22: acc=0.820 [0.795, 0.842] p=0.0000 *
Probing:  64%|██████▎   | 107/168 [10:03<05:45,  5.67s/it]2026-01-27 23:04:11,445 - INFO -   Layer 23: acc=0.834 [0.810, 0.856] p=0.0000 *
Probing:  64%|██████▍   | 108/168 [10:09<05:41,  5.69s/it]2026-01-27 23:04:17,036 - INFO -   Layer 24: acc=0.831 [0.807, 0.853] p=0.0000 *
Probing:  65%|██████▍   | 109/168 [10:15<05:33,  5.66s/it]2026-01-27 23:04:22,685 - INFO -   Layer 25: acc=0.841 [0.817, 0.862] p=0.0000 *
Probing:  65%|██████▌   | 110/168 [10:20<05:27,  5.65s/it]2026-01-27 23:04:28,443 - INFO -   Layer 26: acc=0.832 [0.808, 0.854] p=0.0000 *
Probing:  66%|██████▌   | 111/168 [10:26<05:24,  5.69s/it]2026-01-27 23:04:33,991 - INFO -   Layer 27: acc=0.814 [0.789, 0.836] p=0.0000 *
Probing:  67%|██████▋   | 112/168 [10:32<05:16,  5.64s/it]2026-01-27 23:04:33,992 - INFO - Probing feature: year_p1_newer
2026-01-27 23:04:39,889 - INFO -   Layer 0: acc=0.688 [0.659, 0.716] p=0.0000 *
Probing:  67%|██████▋   | 113/168 [10:37<05:14,  5.72s/it]2026-01-27 23:04:45,167 - INFO -   Layer 1: acc=0.700 [0.671, 0.727] p=0.0000 *
Probing:  68%|██████▊   | 114/168 [10:43<05:01,  5.59s/it]2026-01-27 23:04:50,775 - INFO -   Layer 2: acc=0.760 [0.733, 0.785] p=0.0000 *
Probing:  68%|██████▊   | 115/168 [10:48<04:56,  5.59s/it]2026-01-27 23:04:56,613 - INFO -   Layer 3: acc=0.747 [0.719, 0.772] p=0.0000 *
Probing:  69%|██████▉   | 116/168 [10:54<04:54,  5.67s/it]2026-01-27 23:05:02,360 - INFO -   Layer 4: acc=0.779 [0.752, 0.803] p=0.0000 *
Probing:  70%|██████▉   | 117/168 [11:00<04:50,  5.69s/it]2026-01-27 23:05:08,012 - INFO -   Layer 5: acc=0.750 [0.722, 0.775] p=0.0000 *
Probing:  70%|███████   | 118/168 [11:06<04:43,  5.68s/it]2026-01-27 23:05:13,792 - INFO -   Layer 6: acc=0.756 [0.729, 0.782] p=0.0000 *
Probing:  71%|███████   | 119/168 [11:11<04:39,  5.71s/it]2026-01-27 23:05:19,437 - INFO -   Layer 7: acc=0.783 [0.756, 0.807] p=0.0000 *
Probing:  71%|███████▏  | 120/168 [11:17<04:33,  5.69s/it]2026-01-27 23:05:25,166 - INFO -   Layer 8: acc=0.849 [0.826, 0.870] p=0.0000 *
Probing:  72%|███████▏  | 121/168 [11:23<04:27,  5.70s/it]2026-01-27 23:05:30,984 - INFO -   Layer 9: acc=0.845 [0.822, 0.866] p=0.0000 *
Probing:  73%|███████▎  | 122/168 [11:29<04:23,  5.74s/it]2026-01-27 23:05:36,698 - INFO -   Layer 10: acc=0.863 [0.840, 0.882] p=0.0000 *
Probing:  73%|███████▎  | 123/168 [11:34<04:17,  5.73s/it]2026-01-27 23:05:42,703 - INFO -   Layer 11: acc=0.917 [0.899, 0.933] p=0.0000 *
Probing:  74%|███████▍  | 124/168 [11:40<04:15,  5.81s/it]2026-01-27 23:05:47,767 - INFO -   Layer 12: acc=0.945 [0.930, 0.958] p=0.0000 *
Probing:  74%|███████▍  | 125/168 [11:45<04:00,  5.59s/it]2026-01-27 23:05:52,727 - INFO -   Layer 13: acc=0.958 [0.944, 0.969] p=0.0000 *
Probing:  75%|███████▌  | 126/168 [11:50<03:46,  5.40s/it]2026-01-27 23:05:57,753 - INFO -   Layer 14: acc=0.952 [0.937, 0.964] p=0.0000 *
Probing:  76%|███████▌  | 127/168 [11:55<03:36,  5.29s/it]2026-01-27 23:06:02,564 - INFO -   Layer 15: acc=0.959 [0.945, 0.970] p=0.0000 *
Probing:  76%|███████▌  | 128/168 [12:00<03:25,  5.14s/it]2026-01-27 23:06:07,552 - INFO -   Layer 16: acc=0.953 [0.939, 0.965] p=0.0000 *
Probing:  77%|███████▋  | 129/168 [12:05<03:18,  5.10s/it]2026-01-27 23:06:13,095 - INFO -   Layer 17: acc=0.952 [0.937, 0.964] p=0.0000 *
Probing:  77%|███████▋  | 130/168 [12:11<03:18,  5.23s/it]2026-01-27 23:06:18,203 - INFO -   Layer 18: acc=0.946 [0.931, 0.959] p=0.0000 *
Probing:  78%|███████▊  | 131/168 [12:16<03:12,  5.19s/it]2026-01-27 23:06:23,831 - INFO -   Layer 19: acc=0.941 [0.924, 0.953] p=0.0000 *
Probing:  79%|███████▊  | 132/168 [12:21<03:11,  5.32s/it]2026-01-27 23:06:29,311 - INFO -   Layer 20: acc=0.945 [0.930, 0.958] p=0.0000 *
Probing:  79%|███████▉  | 133/168 [12:27<03:07,  5.37s/it]2026-01-27 23:06:34,768 - INFO -   Layer 21: acc=0.944 [0.929, 0.957] p=0.0000 *
Probing:  80%|███████▉  | 134/168 [12:32<03:03,  5.40s/it]2026-01-27 23:06:40,094 - INFO -   Layer 22: acc=0.939 [0.922, 0.952] p=0.0000 *
Probing:  80%|████████  | 135/168 [12:38<02:57,  5.38s/it]2026-01-27 23:06:45,568 - INFO -   Layer 23: acc=0.952 [0.937, 0.964] p=0.0000 *
Probing:  81%|████████  | 136/168 [12:43<02:52,  5.41s/it]2026-01-27 23:06:50,565 - INFO -   Layer 24: acc=0.943 [0.928, 0.956] p=0.0000 *
Probing:  82%|████████▏ | 137/168 [12:48<02:43,  5.28s/it]2026-01-27 23:06:55,608 - INFO -   Layer 25: acc=0.948 [0.933, 0.960] p=0.0000 *
Probing:  82%|████████▏ | 138/168 [12:53<02:36,  5.21s/it]2026-01-27 23:07:00,877 - INFO -   Layer 26: acc=0.952 [0.937, 0.964] p=0.0000 *
Probing:  83%|████████▎ | 139/168 [12:58<02:31,  5.23s/it]2026-01-27 23:07:06,187 - INFO -   Layer 27: acc=0.952 [0.937, 0.964] p=0.0000 *
Probing:  83%|████████▎ | 140/168 [13:04<02:27,  5.25s/it]2026-01-27 23:07:06,188 - INFO - Probing feature: price_p1_higher
2026-01-27 23:07:11,742 - INFO -   Layer 0: acc=0.559 [0.529, 0.590] p=0.0001 *
Probing:  84%|████████▍ | 141/168 [13:09<02:24,  5.34s/it]Probing:  85%|████████▍ | 142/168 [13:14<02:14,  5.16s/it]Probing:  85%|████████▌ | 143/168 [13:19<02:06,  5.05s/it]2026-01-27 23:07:27,078 - INFO -   Layer 3: acc=0.573 [0.543, 0.603] p=0.0000 *
Probing:  86%|████████▌ | 144/168 [13:25<02:06,  5.28s/it]2026-01-27 23:07:32,816 - INFO -   Layer 4: acc=0.563 [0.533, 0.593] p=0.0000 *
Probing:  86%|████████▋ | 145/168 [13:30<02:04,  5.42s/it]Probing:  87%|████████▋ | 146/168 [13:36<02:01,  5.52s/it]Probing:  88%|████████▊ | 147/168 [13:42<01:58,  5.62s/it]Probing:  88%|████████▊ | 148/168 [13:47<01:47,  5.35s/it]2026-01-27 23:07:54,837 - INFO -   Layer 8: acc=0.566 [0.536, 0.596] p=0.0000 *
Probing:  89%|████████▊ | 149/168 [13:52<01:43,  5.45s/it]Probing:  89%|████████▉ | 150/168 [13:57<01:30,  5.05s/it]2026-01-27 23:08:04,731 - INFO -   Layer 10: acc=0.558 [0.528, 0.589] p=0.0001 *
Probing:  90%|████████▉ | 151/168 [14:02<01:29,  5.27s/it]2026-01-27 23:08:10,310 - INFO -   Layer 11: acc=0.594 [0.563, 0.623] p=0.0000 *
Probing:  90%|█████████ | 152/168 [14:08<01:25,  5.36s/it]2026-01-27 23:08:16,119 - INFO -   Layer 12: acc=0.580 [0.549, 0.610] p=0.0000 *
Probing:  91%|█████████ | 153/168 [14:14<01:22,  5.49s/it]2026-01-27 23:08:21,844 - INFO -   Layer 13: acc=0.593 [0.562, 0.622] p=0.0000 *
Probing:  92%|█████████▏| 154/168 [14:19<01:17,  5.56s/it]2026-01-27 23:08:26,892 - INFO -   Layer 14: acc=0.593 [0.562, 0.622] p=0.0000 *
Probing:  92%|█████████▏| 155/168 [14:24<01:10,  5.41s/it]2026-01-27 23:08:31,841 - INFO -   Layer 15: acc=0.589 [0.558, 0.618] p=0.0000 *
Probing:  93%|█████████▎| 156/168 [14:29<01:03,  5.27s/it]2026-01-27 23:08:36,066 - INFO -   Layer 16: acc=0.572 [0.542, 0.602] p=0.0000 *
Probing:  93%|█████████▎| 157/168 [14:34<00:54,  4.96s/it]2026-01-27 23:08:40,276 - INFO -   Layer 17: acc=0.570 [0.540, 0.600] p=0.0000 *
Probing:  94%|█████████▍| 158/168 [14:38<00:47,  4.73s/it]2026-01-27 23:08:46,163 - INFO -   Layer 18: acc=0.598 [0.568, 0.628] p=0.0000 *
Probing:  95%|█████████▍| 159/168 [14:44<00:45,  5.08s/it]2026-01-27 23:08:51,845 - INFO -   Layer 19: acc=0.607 [0.577, 0.637] p=0.0000 *
Probing:  95%|█████████▌| 160/168 [14:49<00:42,  5.26s/it]2026-01-27 23:08:56,780 - INFO -   Layer 20: acc=0.599 [0.569, 0.629] p=0.0000 *
Probing:  96%|█████████▌| 161/168 [14:54<00:36,  5.16s/it]2026-01-27 23:09:01,561 - INFO -   Layer 21: acc=0.599 [0.569, 0.629] p=0.0000 *
Probing:  96%|█████████▋| 162/168 [14:59<00:30,  5.05s/it]2026-01-27 23:09:06,587 - INFO -   Layer 22: acc=0.603 [0.573, 0.633] p=0.0000 *
Probing:  97%|█████████▋| 163/168 [15:04<00:25,  5.04s/it]2026-01-27 23:09:11,547 - INFO -   Layer 23: acc=0.599 [0.569, 0.629] p=0.0000 *
Probing:  98%|█████████▊| 164/168 [15:09<00:20,  5.02s/it]2026-01-27 23:09:16,339 - INFO -   Layer 24: acc=0.600 [0.570, 0.630] p=0.0000 *
Probing:  98%|█████████▊| 165/168 [15:14<00:14,  4.95s/it]2026-01-27 23:09:22,167 - INFO -   Layer 25: acc=0.597 [0.567, 0.627] p=0.0000 *
Probing:  99%|█████████▉| 166/168 [15:20<00:10,  5.21s/it]2026-01-27 23:09:27,243 - INFO -   Layer 26: acc=0.596 [0.565, 0.625] p=0.0000 *
Probing:  99%|█████████▉| 167/168 [15:25<00:05,  5.17s/it]2026-01-27 23:09:33,025 - INFO -   Layer 27: acc=0.604 [0.574, 0.634] p=0.0000 *
Probing: 100%|██████████| 168/168 [15:31<00:00,  5.35s/it]Probing: 100%|██████████| 168/168 [15:31<00:00,  5.54s/it]
2026-01-27 23:09:33,028 - INFO - Exporting results to CSV...
2026-01-27 23:09:33,067 - INFO - 
============================================================
2026-01-27 23:09:33,067 - INFO - SUMMARY
2026-01-27 23:09:33,067 - INFO - ============================================================
2026-01-27 23:09:33,067 - INFO - 
Best Layer per Feature (Test Set):
2026-01-27 23:09:33,068 - INFO -   bathrooms_p1_more:
2026-01-27 23:09:33,068 - INFO -     Layer 15: acc=0.902 [0.882, 0.918] AUC=0.942 p=0.0000 *
2026-01-27 23:09:33,068 - INFO -   bedrooms_p1_more:
2026-01-27 23:09:33,068 - INFO -     Layer 15: acc=0.910 [0.891, 0.926] AUC=0.961 p=0.0000 *
2026-01-27 23:09:33,069 - INFO -   sqft_p1_larger:
2026-01-27 23:09:33,069 - INFO -     Layer 15: acc=0.869 [0.847, 0.889] AUC=0.927 p=0.0000 *
2026-01-27 23:09:33,070 - INFO -   lot_p1_larger:
2026-01-27 23:09:33,070 - INFO -     Layer 15: acc=0.869 [0.847, 0.889] AUC=0.927 p=0.0000 *
2026-01-27 23:09:33,071 - INFO -   year_p1_newer:
2026-01-27 23:09:33,071 - INFO -     Layer 15: acc=0.959 [0.945, 0.970] AUC=0.990 p=0.0000 *
2026-01-27 23:09:33,071 - INFO -   price_p1_higher:
2026-01-27 23:09:33,071 - INFO -     Layer 19: acc=0.607 [0.577, 0.637] AUC=0.628 p=0.0000 *
2026-01-27 23:09:33,072 - INFO - 
Significant probes: 167/168 (99.4%)
2026-01-27 23:09:33,072 - INFO - 
Mean Test Accuracy by Layer (top 5):
2026-01-27 23:09:33,073 - INFO -   Layer 15: 0.850
2026-01-27 23:09:33,073 - INFO -   Layer 14: 0.841
2026-01-27 23:09:33,073 - INFO -   Layer 16: 0.840
2026-01-27 23:09:33,073 - INFO -   Layer 18: 0.835
2026-01-27 23:09:33,073 - INFO -   Layer 17: 0.834
2026-01-27 23:09:33,073 - INFO - 
Results saved to: /home/anshulk/Housing/data/probe_results
2026-01-27 23:09:37,729 - INFO - Logging to /home/anshulk/Housing/data/probe_results/logs/probe_qwen3-4b_2_fewshot_cot_temp0_20260127_230937.log
2026-01-27 23:09:37,729 - INFO - Loading activations from /home/anshulk/Housing/data/activations/qwen3-4b_2_fewshot_cot_temp0_activations.npz
2026-01-27 23:09:51,115 - INFO - Loaded activations: (5130, 36, 2560)
2026-01-27 23:09:51,116 - INFO - Labels shape: (5130,)
2026-01-27 23:09:51,116 - INFO - Feature labels columns: ['bathrooms_p1_more', 'bedrooms_p1_more', 'year_p1_newer', 'lot_p1_larger', 'sqft_p1_larger', 'price_p1_higher']
2026-01-27 23:09:51,116 - INFO - Model: qwen3-4b
2026-01-27 23:09:51,116 - INFO - Condition: 2_fewshot_cot_temp0
2026-01-27 23:09:51,116 - INFO - Samples: 5130
2026-01-27 23:09:51,116 - INFO - Layers: 36
2026-01-27 23:09:51,116 - INFO - D_model: 2560
2026-01-27 23:09:51,116 - INFO - Features: ['bathrooms_p1_more', 'bedrooms_p1_more', 'sqft_p1_larger', 'lot_p1_larger', 'year_p1_newer', 'price_p1_higher']
2026-01-27 23:09:51,116 - INFO - Split: 70/10/20 (train/val/test)
2026-01-27 23:09:51,116 - INFO - C selection: Validation set (fast mode)
2026-01-27 23:09:51,116 - INFO - GPU acceleration: ENABLED (cuML - full pipeline)
2026-01-27 23:09:51,116 - INFO - Creating stratified train/val/test splits...
2026-01-27 23:09:51,122 - INFO -   Train: 3590 samples
2026-01-27 23:09:51,122 - INFO -   Val: 514 samples
2026-01-27 23:09:51,122 - INFO -   Test: 1026 samples
Probing:   0%|          | 0/216 [00:00<?, ?it/s]2026-01-27 23:09:51,126 - INFO - Probing feature: bathrooms_p1_more
2026-01-27 23:09:55,061 - INFO -   Layer 0: acc=0.689 [0.660, 0.717] p=0.0000 *
Probing:   0%|          | 1/216 [00:03<14:06,  3.94s/it]2026-01-27 23:09:59,147 - INFO -   Layer 1: acc=0.682 [0.653, 0.710] p=0.0000 *
Probing:   1%|          | 2/216 [00:08<14:21,  4.02s/it]2026-01-27 23:10:02,947 - INFO -   Layer 2: acc=0.683 [0.654, 0.711] p=0.0000 *
Probing:   1%|▏         | 3/216 [00:11<13:55,  3.92s/it]2026-01-27 23:10:07,419 - INFO -   Layer 3: acc=0.687 [0.658, 0.715] p=0.0000 *
Probing:   2%|▏         | 4/216 [00:16<14:37,  4.14s/it]2026-01-27 23:10:11,719 - INFO -   Layer 4: acc=0.693 [0.664, 0.720] p=0.0000 *
Probing:   2%|▏         | 5/216 [00:20<14:45,  4.20s/it]2026-01-27 23:10:15,912 - INFO -   Layer 5: acc=0.693 [0.664, 0.720] p=0.0000 *
Probing:   3%|▎         | 6/216 [00:24<14:41,  4.20s/it]2026-01-27 23:10:20,032 - INFO -   Layer 6: acc=0.701 [0.672, 0.728] p=0.0000 *
Probing:   3%|▎         | 7/216 [00:28<14:31,  4.17s/it]2026-01-27 23:10:23,230 - INFO -   Layer 7: acc=0.689 [0.660, 0.717] p=0.0000 *
Probing:   4%|▎         | 8/216 [00:32<13:23,  3.86s/it]2026-01-27 23:10:28,248 - INFO -   Layer 8: acc=0.712 [0.684, 0.739] p=0.0000 *
Probing:   4%|▍         | 9/216 [00:37<14:34,  4.22s/it]2026-01-27 23:10:33,254 - INFO -   Layer 9: acc=0.685 [0.656, 0.713] p=0.0000 *
Probing:   5%|▍         | 10/216 [00:42<15:19,  4.46s/it]2026-01-27 23:10:38,342 - INFO -   Layer 10: acc=0.757 [0.730, 0.783] p=0.0000 *
Probing:   5%|▌         | 11/216 [00:47<15:54,  4.66s/it]2026-01-27 23:10:43,715 - INFO -   Layer 11: acc=0.761 [0.734, 0.786] p=0.0000 *
Probing:   6%|▌         | 12/216 [00:52<16:34,  4.87s/it]2026-01-27 23:10:48,846 - INFO -   Layer 12: acc=0.789 [0.763, 0.813] p=0.0000 *
Probing:   6%|▌         | 13/216 [00:57<16:45,  4.95s/it]2026-01-27 23:10:53,977 - INFO -   Layer 13: acc=0.787 [0.760, 0.811] p=0.0000 *
Probing:   6%|▋         | 14/216 [01:02<16:51,  5.01s/it]2026-01-27 23:10:58,550 - INFO -   Layer 14: acc=0.797 [0.772, 0.821] p=0.0000 *
Probing:   7%|▋         | 15/216 [01:07<16:19,  4.88s/it]2026-01-27 23:11:03,468 - INFO -   Layer 15: acc=0.812 [0.787, 0.835] p=0.0000 *
Probing:   7%|▋         | 16/216 [01:12<16:17,  4.89s/it]2026-01-27 23:11:08,579 - INFO -   Layer 16: acc=0.852 [0.829, 0.872] p=0.0000 *
Probing:   8%|▊         | 17/216 [01:17<16:26,  4.96s/it]2026-01-27 23:11:13,934 - INFO -   Layer 17: acc=0.866 [0.844, 0.886] p=0.0000 *
Probing:   8%|▊         | 18/216 [01:22<16:44,  5.08s/it]2026-01-27 23:11:19,063 - INFO -   Layer 18: acc=0.862 [0.839, 0.881] p=0.0000 *
Probing:   9%|▉         | 19/216 [01:27<16:43,  5.09s/it]2026-01-27 23:11:24,252 - INFO -   Layer 19: acc=0.897 [0.877, 0.914] p=0.0000 *
Probing:   9%|▉         | 20/216 [01:33<16:43,  5.12s/it]2026-01-27 23:11:28,935 - INFO -   Layer 20: acc=0.884 [0.863, 0.902] p=0.0000 *
Probing:  10%|▉         | 21/216 [01:37<16:12,  4.99s/it]2026-01-27 23:11:33,602 - INFO -   Layer 21: acc=0.885 [0.864, 0.903] p=0.0000 *
Probing:  10%|█         | 22/216 [01:42<15:49,  4.89s/it]2026-01-27 23:11:38,723 - INFO -   Layer 22: acc=0.894 [0.873, 0.911] p=0.0000 *
Probing:  11%|█         | 23/216 [01:47<15:57,  4.96s/it]2026-01-27 23:11:43,842 - INFO -   Layer 23: acc=0.889 [0.868, 0.907] p=0.0000 *
Probing:  11%|█         | 24/216 [01:52<16:01,  5.01s/it]2026-01-27 23:11:48,608 - INFO -   Layer 24: acc=0.873 [0.852, 0.892] p=0.0000 *
Probing:  12%|█▏        | 25/216 [01:57<15:42,  4.94s/it]2026-01-27 23:11:53,448 - INFO -   Layer 25: acc=0.864 [0.841, 0.883] p=0.0000 *
Probing:  12%|█▏        | 26/216 [02:02<15:32,  4.91s/it]2026-01-27 23:11:58,189 - INFO -   Layer 26: acc=0.857 [0.834, 0.877] p=0.0000 *
Probing:  12%|█▎        | 27/216 [02:07<15:18,  4.86s/it]2026-01-27 23:12:02,826 - INFO -   Layer 27: acc=0.857 [0.834, 0.877] p=0.0000 *
Probing:  13%|█▎        | 28/216 [02:11<15:00,  4.79s/it]2026-01-27 23:12:07,996 - INFO -   Layer 28: acc=0.851 [0.828, 0.871] p=0.0000 *
Probing:  13%|█▎        | 29/216 [02:16<15:17,  4.90s/it]2026-01-27 23:12:13,427 - INFO -   Layer 29: acc=0.846 [0.823, 0.867] p=0.0000 *
Probing:  14%|█▍        | 30/216 [02:22<15:41,  5.06s/it]2026-01-27 23:12:18,534 - INFO -   Layer 30: acc=0.845 [0.822, 0.866] p=0.0000 *
Probing:  14%|█▍        | 31/216 [02:27<15:39,  5.08s/it]2026-01-27 23:12:23,640 - INFO -   Layer 31: acc=0.851 [0.828, 0.871] p=0.0000 *
Probing:  15%|█▍        | 32/216 [02:32<15:35,  5.08s/it]2026-01-27 23:12:28,706 - INFO -   Layer 32: acc=0.860 [0.837, 0.880] p=0.0000 *
Probing:  15%|█▌        | 33/216 [02:37<15:29,  5.08s/it]2026-01-27 23:12:33,862 - INFO -   Layer 33: acc=0.851 [0.828, 0.871] p=0.0000 *
Probing:  16%|█▌        | 34/216 [02:42<15:28,  5.10s/it]2026-01-27 23:12:38,924 - INFO -   Layer 34: acc=0.858 [0.835, 0.878] p=0.0000 *
Probing:  16%|█▌        | 35/216 [02:47<15:21,  5.09s/it]2026-01-27 23:12:43,731 - INFO -   Layer 35: acc=0.840 [0.816, 0.861] p=0.0000 *
Probing:  17%|█▋        | 36/216 [02:52<15:00,  5.01s/it]2026-01-27 23:12:43,732 - INFO - Probing feature: bedrooms_p1_more
2026-01-27 23:12:47,097 - INFO -   Layer 0: acc=0.686 [0.657, 0.714] p=0.0000 *
Probing:  17%|█▋        | 37/216 [02:55<13:27,  4.51s/it]2026-01-27 23:12:50,545 - INFO -   Layer 1: acc=0.686 [0.657, 0.714] p=0.0000 *
Probing:  18%|█▊        | 38/216 [02:59<12:26,  4.19s/it]2026-01-27 23:12:54,042 - INFO -   Layer 2: acc=0.686 [0.657, 0.714] p=0.0000 *
Probing:  18%|█▊        | 39/216 [03:02<11:45,  3.98s/it]2026-01-27 23:12:59,024 - INFO -   Layer 3: acc=0.694 [0.665, 0.721] p=0.0000 *
Probing:  19%|█▊        | 40/216 [03:07<12:33,  4.28s/it]2026-01-27 23:13:03,526 - INFO -   Layer 4: acc=0.683 [0.654, 0.711] p=0.0000 *
Probing:  19%|█▉        | 41/216 [03:12<12:41,  4.35s/it]2026-01-27 23:13:07,897 - INFO -   Layer 5: acc=0.698 [0.669, 0.725] p=0.0000 *
Probing:  19%|█▉        | 42/216 [03:16<12:37,  4.36s/it]2026-01-27 23:13:12,393 - INFO -   Layer 6: acc=0.697 [0.668, 0.724] p=0.0000 *
Probing:  20%|█▉        | 43/216 [03:21<12:40,  4.40s/it]2026-01-27 23:13:17,011 - INFO -   Layer 7: acc=0.679 [0.650, 0.707] p=0.0000 *
Probing:  20%|██        | 44/216 [03:25<12:47,  4.46s/it]2026-01-27 23:13:21,720 - INFO -   Layer 8: acc=0.699 [0.670, 0.726] p=0.0000 *
Probing:  21%|██        | 45/216 [03:30<12:55,  4.54s/it]2026-01-27 23:13:25,683 - INFO -   Layer 9: acc=0.690 [0.661, 0.718] p=0.0000 *
Probing:  21%|██▏       | 46/216 [03:34<12:22,  4.36s/it]2026-01-27 23:13:30,541 - INFO -   Layer 10: acc=0.707 [0.678, 0.734] p=0.0000 *
Probing:  22%|██▏       | 47/216 [03:39<12:42,  4.51s/it]2026-01-27 23:13:35,699 - INFO -   Layer 11: acc=0.698 [0.669, 0.725] p=0.0000 *
Probing:  22%|██▏       | 48/216 [03:44<13:10,  4.71s/it]2026-01-27 23:13:40,892 - INFO -   Layer 12: acc=0.738 [0.710, 0.764] p=0.0000 *
Probing:  23%|██▎       | 49/216 [03:49<13:30,  4.85s/it]2026-01-27 23:13:46,305 - INFO -   Layer 13: acc=0.745 [0.717, 0.770] p=0.0000 *
Probing:  23%|██▎       | 50/216 [03:55<13:53,  5.02s/it]2026-01-27 23:13:51,067 - INFO -   Layer 14: acc=0.762 [0.735, 0.787] p=0.0000 *
Probing:  24%|██▎       | 51/216 [03:59<13:35,  4.94s/it]2026-01-27 23:13:56,236 - INFO -   Layer 15: acc=0.778 [0.751, 0.802] p=0.0000 *
Probing:  24%|██▍       | 52/216 [04:05<13:41,  5.01s/it]2026-01-27 23:14:01,374 - INFO -   Layer 16: acc=0.824 [0.799, 0.846] p=0.0000 *
Probing:  25%|██▍       | 53/216 [04:10<13:42,  5.05s/it]2026-01-27 23:14:06,504 - INFO -   Layer 17: acc=0.835 [0.811, 0.857] p=0.0000 *
Probing:  25%|██▌       | 54/216 [04:15<13:41,  5.07s/it]2026-01-27 23:14:11,430 - INFO -   Layer 18: acc=0.873 [0.852, 0.892] p=0.0000 *
Probing:  25%|██▌       | 55/216 [04:20<13:29,  5.03s/it]2026-01-27 23:14:16,608 - INFO -   Layer 19: acc=0.921 [0.903, 0.936] p=0.0000 *
Probing:  26%|██▌       | 56/216 [04:25<13:31,  5.07s/it]2026-01-27 23:14:21,390 - INFO -   Layer 20: acc=0.914 [0.896, 0.930] p=0.0000 *
Probing:  26%|██▋       | 57/216 [04:30<13:12,  4.99s/it]2026-01-27 23:14:25,971 - INFO -   Layer 21: acc=0.910 [0.891, 0.926] p=0.0000 *
Probing:  27%|██▋       | 58/216 [04:34<12:48,  4.86s/it]2026-01-27 23:14:31,084 - INFO -   Layer 22: acc=0.925 [0.907, 0.940] p=0.0000 *
Probing:  27%|██▋       | 59/216 [04:39<12:55,  4.94s/it]2026-01-27 23:14:36,255 - INFO -   Layer 23: acc=0.922 [0.904, 0.937] p=0.0000 *
Probing:  28%|██▊       | 60/216 [04:45<13:01,  5.01s/it]2026-01-27 23:14:41,438 - INFO -   Layer 24: acc=0.904 [0.884, 0.920] p=0.0000 *
Probing:  28%|██▊       | 61/216 [04:50<13:04,  5.06s/it]2026-01-27 23:14:46,140 - INFO -   Layer 25: acc=0.908 [0.889, 0.925] p=0.0000 *
Probing:  29%|██▊       | 62/216 [04:55<12:42,  4.95s/it]2026-01-27 23:14:51,274 - INFO -   Layer 26: acc=0.906 [0.887, 0.923] p=0.0000 *
Probing:  29%|██▉       | 63/216 [05:00<12:46,  5.01s/it]2026-01-27 23:14:56,405 - INFO -   Layer 27: acc=0.906 [0.887, 0.923] p=0.0000 *
Probing:  30%|██▉       | 64/216 [05:05<12:46,  5.04s/it]2026-01-27 23:15:01,524 - INFO -   Layer 28: acc=0.901 [0.881, 0.917] p=0.0000 *
Probing:  30%|███       | 65/216 [05:10<12:45,  5.07s/it]2026-01-27 23:15:05,932 - INFO -   Layer 29: acc=0.894 [0.873, 0.911] p=0.0000 *
Probing:  31%|███       | 66/216 [05:14<12:10,  4.87s/it]2026-01-27 23:15:10,461 - INFO -   Layer 30: acc=0.892 [0.871, 0.909] p=0.0000 *
Probing:  31%|███       | 67/216 [05:19<11:50,  4.77s/it]2026-01-27 23:15:15,135 - INFO -   Layer 31: acc=0.886 [0.865, 0.904] p=0.0000 *
Probing:  31%|███▏      | 68/216 [05:24<11:41,  4.74s/it]2026-01-27 23:15:20,219 - INFO -   Layer 32: acc=0.898 [0.878, 0.915] p=0.0000 *
Probing:  32%|███▏      | 69/216 [05:29<11:51,  4.84s/it]2026-01-27 23:15:25,225 - INFO -   Layer 33: acc=0.905 [0.886, 0.922] p=0.0000 *
Probing:  32%|███▏      | 70/216 [05:34<11:54,  4.89s/it]2026-01-27 23:15:30,305 - INFO -   Layer 34: acc=0.892 [0.871, 0.909] p=0.0000 *
Probing:  33%|███▎      | 71/216 [05:39<11:57,  4.95s/it]2026-01-27 23:15:35,332 - INFO -   Layer 35: acc=0.904 [0.884, 0.920] p=0.0000 *
Probing:  33%|███▎      | 72/216 [05:44<11:55,  4.97s/it]2026-01-27 23:15:35,332 - INFO - Probing feature: sqft_p1_larger
2026-01-27 23:15:40,110 - INFO -   Layer 0: acc=0.594 [0.563, 0.623] p=0.0000 *
Probing:  34%|███▍      | 73/216 [05:48<11:42,  4.91s/it]2026-01-27 23:15:45,134 - INFO -   Layer 1: acc=0.605 [0.575, 0.635] p=0.0000 *
Probing:  34%|███▍      | 74/216 [05:54<11:42,  4.95s/it]2026-01-27 23:15:50,114 - INFO -   Layer 2: acc=0.613 [0.583, 0.642] p=0.0000 *
Probing:  35%|███▍      | 75/216 [05:58<11:38,  4.96s/it]2026-01-27 23:15:54,884 - INFO -   Layer 3: acc=0.630 [0.600, 0.659] p=0.0000 *
Probing:  35%|███▌      | 76/216 [06:03<11:26,  4.90s/it]2026-01-27 23:15:59,403 - INFO -   Layer 4: acc=0.642 [0.612, 0.671] p=0.0000 *
Probing:  36%|███▌      | 77/216 [06:08<11:05,  4.79s/it]2026-01-27 23:16:03,589 - INFO -   Layer 5: acc=0.614 [0.584, 0.643] p=0.0000 *
Probing:  36%|███▌      | 78/216 [06:12<10:35,  4.61s/it]2026-01-27 23:16:07,153 - INFO -   Layer 6: acc=0.588 [0.557, 0.617] p=0.0000 *
Probing:  37%|███▋      | 79/216 [06:16<09:48,  4.29s/it]2026-01-27 23:16:12,070 - INFO -   Layer 7: acc=0.645 [0.615, 0.674] p=0.0000 *
Probing:  37%|███▋      | 80/216 [06:20<10:09,  4.48s/it]2026-01-27 23:16:16,657 - INFO -   Layer 8: acc=0.629 [0.599, 0.658] p=0.0000 *
Probing:  38%|███▊      | 81/216 [06:25<10:09,  4.51s/it]2026-01-27 23:16:21,771 - INFO -   Layer 9: acc=0.637 [0.608, 0.666] p=0.0000 *
Probing:  38%|███▊      | 82/216 [06:30<10:28,  4.69s/it]2026-01-27 23:16:27,017 - INFO -   Layer 10: acc=0.635 [0.606, 0.664] p=0.0000 *
Probing:  38%|███▊      | 83/216 [06:35<10:46,  4.86s/it]2026-01-27 23:16:32,315 - INFO -   Layer 11: acc=0.655 [0.625, 0.683] p=0.0000 *
Probing:  39%|███▉      | 84/216 [06:41<10:58,  4.99s/it]2026-01-27 23:16:37,555 - INFO -   Layer 12: acc=0.634 [0.604, 0.662] p=0.0000 *
Probing:  39%|███▉      | 85/216 [06:46<11:03,  5.07s/it]2026-01-27 23:16:42,808 - INFO -   Layer 13: acc=0.642 [0.612, 0.671] p=0.0000 *
Probing:  40%|███▉      | 86/216 [06:51<11:05,  5.12s/it]2026-01-27 23:16:48,012 - INFO -   Layer 14: acc=0.736 [0.708, 0.762] p=0.0000 *
Probing:  40%|████      | 87/216 [06:56<11:03,  5.15s/it]2026-01-27 23:16:53,244 - INFO -   Layer 15: acc=0.766 [0.739, 0.791] p=0.0000 *
Probing:  41%|████      | 88/216 [07:02<11:02,  5.17s/it]2026-01-27 23:16:58,519 - INFO -   Layer 16: acc=0.789 [0.763, 0.813] p=0.0000 *
Probing:  41%|████      | 89/216 [07:07<11:00,  5.20s/it]2026-01-27 23:17:03,767 - INFO -   Layer 17: acc=0.827 [0.803, 0.849] p=0.0000 *
Probing:  42%|████▏     | 90/216 [07:12<10:57,  5.22s/it]2026-01-27 23:17:08,767 - INFO -   Layer 18: acc=0.855 [0.832, 0.875] p=0.0000 *
Probing:  42%|████▏     | 91/216 [07:17<10:43,  5.15s/it]2026-01-27 23:17:14,059 - INFO -   Layer 19: acc=0.888 [0.867, 0.906] p=0.0000 *
Probing:  43%|████▎     | 92/216 [07:22<10:43,  5.19s/it]2026-01-27 23:17:19,247 - INFO -   Layer 20: acc=0.873 [0.852, 0.892] p=0.0000 *
Probing:  43%|████▎     | 93/216 [07:28<10:38,  5.19s/it]2026-01-27 23:17:24,487 - INFO -   Layer 21: acc=0.861 [0.838, 0.880] p=0.0000 *
Probing:  44%|████▎     | 94/216 [07:33<10:35,  5.21s/it]2026-01-27 23:17:29,641 - INFO -   Layer 22: acc=0.870 [0.848, 0.890] p=0.0000 *
Probing:  44%|████▍     | 95/216 [07:38<10:28,  5.19s/it]2026-01-27 23:17:34,327 - INFO -   Layer 23: acc=0.879 [0.858, 0.898] p=0.0000 *
Probing:  44%|████▍     | 96/216 [07:43<10:04,  5.04s/it]2026-01-27 23:17:39,486 - INFO -   Layer 24: acc=0.875 [0.854, 0.894] p=0.0000 *
Probing:  45%|████▍     | 97/216 [07:48<10:03,  5.08s/it]2026-01-27 23:17:44,777 - INFO -   Layer 25: acc=0.881 [0.860, 0.899] p=0.0000 *
Probing:  45%|████▌     | 98/216 [07:53<10:06,  5.14s/it]2026-01-27 23:17:50,041 - INFO -   Layer 26: acc=0.868 [0.846, 0.888] p=0.0000 *
Probing:  46%|████▌     | 99/216 [07:58<10:05,  5.18s/it]2026-01-27 23:17:55,150 - INFO -   Layer 27: acc=0.865 [0.843, 0.885] p=0.0000 *
Probing:  46%|████▋     | 100/216 [08:04<09:58,  5.16s/it]2026-01-27 23:18:00,336 - INFO -   Layer 28: acc=0.861 [0.838, 0.880] p=0.0000 *
Probing:  47%|████▋     | 101/216 [08:09<09:54,  5.17s/it]2026-01-27 23:18:05,568 - INFO -   Layer 29: acc=0.848 [0.825, 0.869] p=0.0000 *
Probing:  47%|████▋     | 102/216 [08:14<09:51,  5.19s/it]2026-01-27 23:18:10,463 - INFO -   Layer 30: acc=0.844 [0.821, 0.865] p=0.0000 *
Probing:  48%|████▊     | 103/216 [08:19<09:36,  5.10s/it]2026-01-27 23:18:15,879 - INFO -   Layer 31: acc=0.849 [0.826, 0.870] p=0.0000 *
Probing:  48%|████▊     | 104/216 [08:24<09:41,  5.19s/it]2026-01-27 23:18:21,122 - INFO -   Layer 32: acc=0.852 [0.829, 0.872] p=0.0000 *
Probing:  49%|████▊     | 105/216 [08:29<09:38,  5.21s/it]2026-01-27 23:18:26,268 - INFO -   Layer 33: acc=0.844 [0.821, 0.865] p=0.0000 *
Probing:  49%|████▉     | 106/216 [08:35<09:30,  5.19s/it]2026-01-27 23:18:30,788 - INFO -   Layer 34: acc=0.834 [0.810, 0.856] p=0.0000 *
Probing:  50%|████▉     | 107/216 [08:39<09:03,  4.99s/it]2026-01-27 23:18:35,923 - INFO -   Layer 35: acc=0.842 [0.819, 0.863] p=0.0000 *
Probing:  50%|█████     | 108/216 [08:44<09:03,  5.03s/it]2026-01-27 23:18:35,924 - INFO - Probing feature: lot_p1_larger
2026-01-27 23:18:41,150 - INFO -   Layer 0: acc=0.592 [0.561, 0.621] p=0.0000 *
Probing:  50%|█████     | 109/216 [08:50<09:04,  5.09s/it]2026-01-27 23:18:46,473 - INFO -   Layer 1: acc=0.618 [0.588, 0.647] p=0.0000 *
Probing:  51%|█████     | 110/216 [08:55<09:07,  5.16s/it]2026-01-27 23:18:51,527 - INFO -   Layer 2: acc=0.625 [0.595, 0.654] p=0.0000 *
Probing:  51%|█████▏    | 111/216 [09:00<08:58,  5.13s/it]2026-01-27 23:18:56,644 - INFO -   Layer 3: acc=0.636 [0.607, 0.665] p=0.0000 *
Probing:  52%|█████▏    | 112/216 [09:05<08:53,  5.13s/it]2026-01-27 23:19:01,566 - INFO -   Layer 4: acc=0.652 [0.622, 0.681] p=0.0000 *
Probing:  52%|█████▏    | 113/216 [09:10<08:41,  5.06s/it]2026-01-27 23:19:06,198 - INFO -   Layer 5: acc=0.620 [0.590, 0.649] p=0.0000 *
Probing:  53%|█████▎    | 114/216 [09:15<08:23,  4.93s/it]2026-01-27 23:19:10,105 - INFO -   Layer 6: acc=0.588 [0.557, 0.617] p=0.0000 *
Probing:  53%|█████▎    | 115/216 [09:18<07:47,  4.63s/it]2026-01-27 23:19:15,117 - INFO -   Layer 7: acc=0.633 [0.603, 0.662] p=0.0000 *
Probing:  54%|█████▎    | 116/216 [09:23<07:54,  4.74s/it]2026-01-27 23:19:19,944 - INFO -   Layer 8: acc=0.627 [0.597, 0.656] p=0.0000 *
Probing:  54%|█████▍    | 117/216 [09:28<07:51,  4.77s/it]2026-01-27 23:19:25,125 - INFO -   Layer 9: acc=0.643 [0.613, 0.672] p=0.0000 *
Probing:  55%|█████▍    | 118/216 [09:34<07:59,  4.89s/it]2026-01-27 23:19:30,412 - INFO -   Layer 10: acc=0.639 [0.610, 0.668] p=0.0000 *
Probing:  55%|█████▌    | 119/216 [09:39<08:05,  5.01s/it]2026-01-27 23:19:35,564 - INFO -   Layer 11: acc=0.651 [0.621, 0.680] p=0.0000 *
Probing:  56%|█████▌    | 120/216 [09:44<08:05,  5.05s/it]2026-01-27 23:19:40,692 - INFO -   Layer 12: acc=0.633 [0.603, 0.662] p=0.0000 *
Probing:  56%|█████▌    | 121/216 [09:49<08:02,  5.08s/it]2026-01-27 23:19:45,986 - INFO -   Layer 13: acc=0.645 [0.615, 0.674] p=0.0000 *
Probing:  56%|█████▋    | 122/216 [09:54<08:03,  5.14s/it]2026-01-27 23:19:50,866 - INFO -   Layer 14: acc=0.711 [0.682, 0.737] p=0.0000 *
Probing:  57%|█████▋    | 123/216 [09:59<07:50,  5.06s/it]2026-01-27 23:19:56,088 - INFO -   Layer 15: acc=0.761 [0.734, 0.786] p=0.0000 *
Probing:  57%|█████▋    | 124/216 [10:04<07:50,  5.11s/it]2026-01-27 23:20:01,255 - INFO -   Layer 16: acc=0.800 [0.775, 0.824] p=0.0000 *
Probing:  58%|█████▊    | 125/216 [10:10<07:46,  5.13s/it]2026-01-27 23:20:06,517 - INFO -   Layer 17: acc=0.830 [0.806, 0.852] p=0.0000 *
Probing:  58%|█████▊    | 126/216 [10:15<07:45,  5.17s/it]2026-01-27 23:20:11,994 - INFO -   Layer 18: acc=0.865 [0.842, 0.884] p=0.0000 *
Probing:  59%|█████▉    | 127/216 [10:20<07:48,  5.26s/it]2026-01-27 23:20:17,092 - INFO -   Layer 19: acc=0.886 [0.865, 0.904] p=0.0000 *
Probing:  59%|█████▉    | 128/216 [10:25<07:38,  5.21s/it]2026-01-27 23:20:22,281 - INFO -   Layer 20: acc=0.872 [0.851, 0.891] p=0.0000 *
Probing:  60%|█████▉    | 129/216 [10:31<07:32,  5.20s/it]2026-01-27 23:20:27,440 - INFO -   Layer 21: acc=0.861 [0.838, 0.880] p=0.0000 *
Probing:  60%|██████    | 130/216 [10:36<07:26,  5.19s/it]2026-01-27 23:20:32,656 - INFO -   Layer 22: acc=0.871 [0.849, 0.890] p=0.0000 *
Probing:  61%|██████    | 131/216 [10:41<07:21,  5.20s/it]2026-01-27 23:20:37,907 - INFO -   Layer 23: acc=0.888 [0.867, 0.906] p=0.0000 *
Probing:  61%|██████    | 132/216 [10:46<07:18,  5.21s/it]2026-01-27 23:20:43,468 - INFO -   Layer 24: acc=0.876 [0.855, 0.895] p=0.0000 *
Probing:  62%|██████▏   | 133/216 [10:52<07:21,  5.32s/it]2026-01-27 23:20:48,684 - INFO -   Layer 25: acc=0.886 [0.865, 0.904] p=0.0000 *
Probing:  62%|██████▏   | 134/216 [10:57<07:13,  5.29s/it]2026-01-27 23:20:53,963 - INFO -   Layer 26: acc=0.869 [0.847, 0.889] p=0.0000 *
Probing:  62%|██████▎   | 135/216 [11:02<07:08,  5.29s/it]2026-01-27 23:20:59,179 - INFO -   Layer 27: acc=0.862 [0.839, 0.881] p=0.0000 *
Probing:  63%|██████▎   | 136/216 [11:08<07:01,  5.26s/it]2026-01-27 23:21:04,301 - INFO -   Layer 28: acc=0.862 [0.839, 0.881] p=0.0000 *
Probing:  63%|██████▎   | 137/216 [11:13<06:52,  5.22s/it]2026-01-27 23:21:09,538 - INFO -   Layer 29: acc=0.850 [0.827, 0.870] p=0.0000 *
Probing:  64%|██████▍   | 138/216 [11:18<06:47,  5.23s/it]2026-01-27 23:21:14,827 - INFO -   Layer 30: acc=0.849 [0.826, 0.870] p=0.0000 *
Probing:  64%|██████▍   | 139/216 [11:23<06:43,  5.25s/it]2026-01-27 23:21:19,956 - INFO -   Layer 31: acc=0.845 [0.822, 0.866] p=0.0000 *
Probing:  65%|██████▍   | 140/216 [11:28<06:35,  5.21s/it]2026-01-27 23:21:25,149 - INFO -   Layer 32: acc=0.853 [0.830, 0.873] p=0.0000 *
Probing:  65%|██████▌   | 141/216 [11:34<06:30,  5.21s/it]2026-01-27 23:21:30,350 - INFO -   Layer 33: acc=0.846 [0.823, 0.867] p=0.0000 *
Probing:  66%|██████▌   | 142/216 [11:39<06:25,  5.20s/it]2026-01-27 23:21:34,805 - INFO -   Layer 34: acc=0.831 [0.807, 0.853] p=0.0000 *
Probing:  66%|██████▌   | 143/216 [11:43<06:03,  4.98s/it]2026-01-27 23:21:39,967 - INFO -   Layer 35: acc=0.851 [0.828, 0.871] p=0.0000 *
Probing:  67%|██████▋   | 144/216 [11:48<06:02,  5.03s/it]2026-01-27 23:21:39,968 - INFO - Probing feature: year_p1_newer
2026-01-27 23:21:45,244 - INFO -   Layer 0: acc=0.570 [0.540, 0.600] p=0.0000 *
Probing:  67%|██████▋   | 145/216 [11:54<06:02,  5.11s/it]2026-01-27 23:21:50,271 - INFO -   Layer 1: acc=0.568 [0.538, 0.598] p=0.0000 *
Probing:  68%|██████▊   | 146/216 [11:59<05:55,  5.08s/it]2026-01-27 23:21:54,269 - INFO -   Layer 2: acc=0.561 [0.531, 0.591] p=0.0000 *
Probing:  68%|██████▊   | 147/216 [12:03<05:28,  4.76s/it]2026-01-27 23:21:59,262 - INFO -   Layer 3: acc=0.590 [0.559, 0.619] p=0.0000 *
Probing:  69%|██████▊   | 148/216 [12:08<05:28,  4.83s/it]2026-01-27 23:22:04,271 - INFO -   Layer 4: acc=0.607 [0.577, 0.637] p=0.0000 *
Probing:  69%|██████▉   | 149/216 [12:13<05:27,  4.88s/it]2026-01-27 23:22:08,711 - INFO -   Layer 5: acc=0.588 [0.557, 0.617] p=0.0000 *
Probing:  69%|██████▉   | 150/216 [12:17<05:13,  4.75s/it]2026-01-27 23:22:13,942 - INFO -   Layer 6: acc=0.611 [0.581, 0.640] p=0.0000 *
Probing:  70%|██████▉   | 151/216 [12:22<05:18,  4.89s/it]2026-01-27 23:22:18,487 - INFO -   Layer 7: acc=0.604 [0.574, 0.634] p=0.0000 *
Probing:  70%|███████   | 152/216 [12:27<05:06,  4.79s/it]2026-01-27 23:22:23,537 - INFO -   Layer 8: acc=0.616 [0.586, 0.645] p=0.0000 *
Probing:  71%|███████   | 153/216 [12:32<05:06,  4.87s/it]2026-01-27 23:22:28,515 - INFO -   Layer 9: acc=0.633 [0.603, 0.662] p=0.0000 *
Probing:  71%|███████▏  | 154/216 [12:37<05:03,  4.90s/it]2026-01-27 23:22:33,762 - INFO -   Layer 10: acc=0.699 [0.670, 0.726] p=0.0000 *
Probing:  72%|███████▏  | 155/216 [12:42<05:05,  5.00s/it]2026-01-27 23:22:38,907 - INFO -   Layer 11: acc=0.683 [0.654, 0.711] p=0.0000 *
Probing:  72%|███████▏  | 156/216 [12:47<05:02,  5.05s/it]2026-01-27 23:22:44,352 - INFO -   Layer 12: acc=0.723 [0.695, 0.750] p=0.0000 *
Probing:  73%|███████▎  | 157/216 [12:53<05:04,  5.17s/it]2026-01-27 23:22:49,519 - INFO -   Layer 13: acc=0.727 [0.699, 0.753] p=0.0000 *
Probing:  73%|███████▎  | 158/216 [12:58<04:59,  5.17s/it]2026-01-27 23:22:54,667 - INFO -   Layer 14: acc=0.773 [0.746, 0.797] p=0.0000 *
Probing:  74%|███████▎  | 159/216 [13:03<04:54,  5.16s/it]2026-01-27 23:22:59,854 - INFO -   Layer 15: acc=0.818 [0.793, 0.840] p=0.0000 *
Probing:  74%|███████▍  | 160/216 [13:08<04:49,  5.17s/it]2026-01-27 23:23:04,804 - INFO -   Layer 16: acc=0.848 [0.825, 0.869] p=0.0000 *
Probing:  75%|███████▍  | 161/216 [13:13<04:40,  5.10s/it]2026-01-27 23:23:09,835 - INFO -   Layer 17: acc=0.873 [0.852, 0.892] p=0.0000 *
Probing:  75%|███████▌  | 162/216 [13:18<04:34,  5.08s/it]2026-01-27 23:23:15,216 - INFO -   Layer 18: acc=0.896 [0.876, 0.913] p=0.0000 *
Probing:  75%|███████▌  | 163/216 [13:24<04:34,  5.17s/it]2026-01-27 23:23:20,397 - INFO -   Layer 19: acc=0.935 [0.918, 0.948] p=0.0000 *
Probing:  76%|███████▌  | 164/216 [13:29<04:29,  5.17s/it]2026-01-27 23:23:25,683 - INFO -   Layer 20: acc=0.920 [0.902, 0.935] p=0.0000 *
Probing:  76%|███████▋  | 165/216 [13:34<04:25,  5.21s/it]2026-01-27 23:23:30,568 - INFO -   Layer 21: acc=0.936 [0.919, 0.949] p=0.0000 *
Probing:  77%|███████▋  | 166/216 [13:39<04:15,  5.11s/it]2026-01-27 23:23:35,573 - INFO -   Layer 22: acc=0.939 [0.922, 0.952] p=0.0000 *
Probing:  77%|███████▋  | 167/216 [13:44<04:08,  5.08s/it]2026-01-27 23:23:41,142 - INFO -   Layer 23: acc=0.947 [0.932, 0.959] p=0.0000 *
Probing:  78%|███████▊  | 168/216 [13:50<04:10,  5.23s/it]2026-01-27 23:23:46,395 - INFO -   Layer 24: acc=0.940 [0.923, 0.953] p=0.0000 *
Probing:  78%|███████▊  | 169/216 [13:55<04:06,  5.23s/it]2026-01-27 23:23:51,239 - INFO -   Layer 25: acc=0.924 [0.906, 0.939] p=0.0000 *
Probing:  79%|███████▊  | 170/216 [14:00<03:55,  5.12s/it]2026-01-27 23:23:56,521 - INFO -   Layer 26: acc=0.903 [0.883, 0.919] p=0.0000 *
Probing:  79%|███████▉  | 171/216 [14:05<03:52,  5.17s/it]2026-01-27 23:24:01,258 - INFO -   Layer 27: acc=0.914 [0.896, 0.930] p=0.0000 *
Probing:  80%|███████▉  | 172/216 [14:10<03:41,  5.04s/it]2026-01-27 23:24:06,166 - INFO -   Layer 28: acc=0.907 [0.888, 0.924] p=0.0000 *
Probing:  80%|████████  | 173/216 [14:15<03:34,  5.00s/it]2026-01-27 23:24:11,136 - INFO -   Layer 29: acc=0.899 [0.879, 0.916] p=0.0000 *
Probing:  81%|████████  | 174/216 [14:20<03:29,  4.99s/it]2026-01-27 23:24:16,238 - INFO -   Layer 30: acc=0.899 [0.879, 0.916] p=0.0000 *
Probing:  81%|████████  | 175/216 [14:25<03:25,  5.02s/it]2026-01-27 23:24:21,303 - INFO -   Layer 31: acc=0.904 [0.885, 0.921] p=0.0000 *
Probing:  81%|████████▏ | 176/216 [14:30<03:21,  5.04s/it]2026-01-27 23:24:26,479 - INFO -   Layer 32: acc=0.900 [0.880, 0.917] p=0.0000 *
Probing:  82%|████████▏ | 177/216 [14:35<03:18,  5.08s/it]2026-01-27 23:24:31,604 - INFO -   Layer 33: acc=0.887 [0.866, 0.905] p=0.0000 *
Probing:  82%|████████▏ | 178/216 [14:40<03:13,  5.09s/it]2026-01-27 23:24:36,753 - INFO -   Layer 34: acc=0.886 [0.865, 0.904] p=0.0000 *
Probing:  83%|████████▎ | 179/216 [14:45<03:09,  5.11s/it]2026-01-27 23:24:41,467 - INFO -   Layer 35: acc=0.889 [0.868, 0.907] p=0.0000 *
Probing:  83%|████████▎ | 180/216 [14:50<02:59,  4.99s/it]2026-01-27 23:24:41,468 - INFO - Probing feature: price_p1_higher
Probing:  84%|████████▍ | 181/216 [14:54<02:42,  4.64s/it]Probing:  84%|████████▍ | 182/216 [14:59<02:42,  4.77s/it]Probing:  85%|████████▍ | 183/216 [15:04<02:41,  4.90s/it]Probing:  85%|████████▌ | 184/216 [15:09<02:34,  4.83s/it]Probing:  86%|████████▌ | 185/216 [15:12<02:19,  4.51s/it]Probing:  86%|████████▌ | 186/216 [15:17<02:19,  4.64s/it]Probing:  87%|████████▋ | 187/216 [15:22<02:18,  4.76s/it]Probing:  87%|████████▋ | 188/216 [15:27<02:15,  4.82s/it]Probing:  88%|████████▊ | 189/216 [15:32<02:12,  4.89s/it]Probing:  88%|████████▊ | 190/216 [15:36<01:58,  4.57s/it]Probing:  88%|████████▊ | 191/216 [15:41<01:59,  4.77s/it]Probing:  89%|████████▉ | 192/216 [15:47<01:56,  4.87s/it]Probing:  89%|████████▉ | 193/216 [15:52<01:54,  4.99s/it]2026-01-27 23:25:48,576 - INFO -   Layer 13: acc=0.556 [0.525, 0.586] p=0.0002 *
Probing:  90%|████████▉ | 194/216 [15:57<01:50,  5.03s/it]2026-01-27 23:25:53,877 - INFO -   Layer 14: acc=0.557 [0.526, 0.587] p=0.0002 *
Probing:  90%|█████████ | 195/216 [16:02<01:47,  5.11s/it]2026-01-27 23:25:59,134 - INFO -   Layer 15: acc=0.577 [0.547, 0.607] p=0.0000 *
Probing:  91%|█████████ | 196/216 [16:08<01:43,  5.16s/it]2026-01-27 23:26:03,372 - INFO -   Layer 16: acc=0.552 [0.521, 0.582] p=0.0005 *
Probing:  91%|█████████ | 197/216 [16:12<01:32,  4.88s/it]2026-01-27 23:26:08,527 - INFO -   Layer 17: acc=0.564 [0.534, 0.594] p=0.0000 *
Probing:  92%|█████████▏| 198/216 [16:17<01:29,  4.96s/it]2026-01-27 23:26:13,886 - INFO -   Layer 18: acc=0.558 [0.527, 0.588] p=0.0001 *
Probing:  92%|█████████▏| 199/216 [16:22<01:26,  5.08s/it]2026-01-27 23:26:17,586 - INFO -   Layer 19: acc=0.573 [0.543, 0.603] p=0.0000 *
Probing:  93%|█████████▎| 200/216 [16:26<01:14,  4.67s/it]2026-01-27 23:26:22,632 - INFO -   Layer 20: acc=0.569 [0.539, 0.599] p=0.0000 *
Probing:  93%|█████████▎| 201/216 [16:31<01:11,  4.78s/it]2026-01-27 23:26:26,721 - INFO -   Layer 21: acc=0.566 [0.536, 0.596] p=0.0000 *
Probing:  94%|█████████▎| 202/216 [16:35<01:04,  4.57s/it]2026-01-27 23:26:30,458 - INFO -   Layer 22: acc=0.567 [0.537, 0.597] p=0.0000 *
Probing:  94%|█████████▍| 203/216 [16:39<00:56,  4.32s/it]2026-01-27 23:26:34,138 - INFO -   Layer 23: acc=0.582 [0.551, 0.612] p=0.0000 *
Probing:  94%|█████████▍| 204/216 [16:43<00:49,  4.13s/it]2026-01-27 23:26:37,916 - INFO -   Layer 24: acc=0.582 [0.551, 0.612] p=0.0000 *
Probing:  95%|█████████▍| 205/216 [16:46<00:44,  4.02s/it]2026-01-27 23:26:42,013 - INFO -   Layer 25: acc=0.571 [0.541, 0.601] p=0.0000 *
Probing:  95%|█████████▌| 206/216 [16:50<00:40,  4.05s/it]2026-01-27 23:26:46,235 - INFO -   Layer 26: acc=0.576 [0.546, 0.606] p=0.0000 *
Probing:  96%|█████████▌| 207/216 [16:55<00:36,  4.10s/it]2026-01-27 23:26:50,343 - INFO -   Layer 27: acc=0.568 [0.538, 0.598] p=0.0000 *
Probing:  96%|█████████▋| 208/216 [16:59<00:32,  4.10s/it]2026-01-27 23:26:54,029 - INFO -   Layer 28: acc=0.566 [0.536, 0.596] p=0.0000 *
Probing:  97%|█████████▋| 209/216 [17:02<00:27,  3.98s/it]2026-01-27 23:26:57,658 - INFO -   Layer 29: acc=0.569 [0.539, 0.599] p=0.0000 *
Probing:  97%|█████████▋| 210/216 [17:06<00:23,  3.87s/it]2026-01-27 23:27:02,392 - INFO -   Layer 30: acc=0.583 [0.552, 0.613] p=0.0000 *
Probing:  98%|█████████▊| 211/216 [17:11<00:20,  4.13s/it]2026-01-27 23:27:06,481 - INFO -   Layer 31: acc=0.579 [0.548, 0.609] p=0.0000 *
Probing:  98%|█████████▊| 212/216 [17:15<00:16,  4.12s/it]2026-01-27 23:27:10,655 - INFO -   Layer 32: acc=0.563 [0.533, 0.593] p=0.0000 *
Probing:  99%|█████████▊| 213/216 [17:19<00:12,  4.14s/it]2026-01-27 23:27:14,805 - INFO -   Layer 33: acc=0.566 [0.536, 0.596] p=0.0000 *
Probing:  99%|█████████▉| 214/216 [17:23<00:08,  4.14s/it]2026-01-27 23:27:18,807 - INFO -   Layer 34: acc=0.586 [0.555, 0.616] p=0.0000 *
Probing: 100%|█████████▉| 215/216 [17:27<00:04,  4.10s/it]2026-01-27 23:27:23,714 - INFO -   Layer 35: acc=0.567 [0.537, 0.597] p=0.0000 *
Probing: 100%|██████████| 216/216 [17:32<00:00,  4.34s/it]Probing: 100%|██████████| 216/216 [17:32<00:00,  4.87s/it]
2026-01-27 23:27:23,718 - INFO - Exporting results to CSV...
2026-01-27 23:27:23,754 - INFO - 
============================================================
2026-01-27 23:27:23,754 - INFO - SUMMARY
2026-01-27 23:27:23,754 - INFO - ============================================================
2026-01-27 23:27:23,754 - INFO - 
Best Layer per Feature (Test Set):
2026-01-27 23:27:23,755 - INFO -   bathrooms_p1_more:
2026-01-27 23:27:23,755 - INFO -     Layer 19: acc=0.897 [0.877, 0.914] AUC=0.944 p=0.0000 *
2026-01-27 23:27:23,756 - INFO -   bedrooms_p1_more:
2026-01-27 23:27:23,756 - INFO -     Layer 22: acc=0.925 [0.907, 0.940] AUC=0.959 p=0.0000 *
2026-01-27 23:27:23,757 - INFO -   sqft_p1_larger:
2026-01-27 23:27:23,757 - INFO -     Layer 19: acc=0.888 [0.867, 0.906] AUC=0.943 p=0.0000 *
2026-01-27 23:27:23,757 - INFO -   lot_p1_larger:
2026-01-27 23:27:23,758 - INFO -     Layer 23: acc=0.888 [0.867, 0.906] AUC=0.927 p=0.0000 *
2026-01-27 23:27:23,758 - INFO -   year_p1_newer:
2026-01-27 23:27:23,758 - INFO -     Layer 23: acc=0.947 [0.932, 0.959] AUC=0.969 p=0.0000 *
2026-01-27 23:27:23,759 - INFO -   price_p1_higher:
2026-01-27 23:27:23,759 - INFO -     Layer 34: acc=0.586 [0.555, 0.616] AUC=0.604 p=0.0000 *
2026-01-27 23:27:23,759 - INFO - 
Significant probes: 211/216 (97.7%)
2026-01-27 23:27:23,759 - INFO - 
Mean Test Accuracy by Layer (top 5):
2026-01-27 23:27:23,760 - INFO -   Layer 23: 0.851
2026-01-27 23:27:23,760 - INFO -   Layer 19: 0.850
2026-01-27 23:27:23,760 - INFO -   Layer 22: 0.844
2026-01-27 23:27:23,760 - INFO -   Layer 24: 0.842
2026-01-27 23:27:23,760 - INFO -   Layer 25: 0.839
2026-01-27 23:27:23,761 - INFO - 
Results saved to: /home/anshulk/Housing/data/probe_results
